Service Request URL,Service Request,Status,Request Date,Description,,,,,
https://www.rva311.com/rvaone/Requests/ViewRequestDetail?requestId=DPU000001712&type=new_cs180228212904&viewRole=,DPU000001712,Completed,"September 17, 2018 8:37 am",Citizen stated the storm drain is clogged and has backed up water into her home. Please follow up.,,,,,
https://www.rva311.com/rvaone/Requests/ViewRequestDetail?requestId=DPW000007724&type=new_cs180221194251&viewRole=,DPW000007724,Completed,"September 17, 2018 8:28 am","W. Laburnum Ave @Hermitage Rd. Traffic signal timing is problematic. Extremely short signal duration for N & S bound vehicles on Hermitage, causing backup of traffic. There is only enough time for 4 - 5 vehicles to legally traverse the intersection. Conversely, the E & W bound vehicles get an extended amount of time to pass through the intersection, increasing the collection of vehicles on Hermitage.",,,,,
https://www.rva311.com/rvaone/Requests/ViewRequestDetail?requestId=DPU000001711&type=new_cs180226204420&viewRole=,DPU000001711,Completed,"September 17, 2018 8:19 am",Light in alley behind address in small alley is out,,,,,
https://www.rva311.com/rvaone/Requests/ViewRequestDetail?requestId=DPW000007723&type=new_cs180301154109&viewRole=,DPW000007723,Completed,"September 17, 2018 8:01 am",Pothole,,,,,
https://www.rva311.com/rvaone/Requests/ViewRequestDetail?requestId=DPW000007721&type=new_cs180221194251&viewRole=,DPW000007721,Completed,"September 17, 2018 7:54 am",traffic light timing has changed. the traffic for hermitage only get 5 seconds of green before the light changes.,,,,,
https://www.rva311.com/rvaone/Requests/ViewRequestDetail?requestId=DPW000007720&type=new_cs180221194656&viewRole=,DPW000007720,Assigned,"September 17, 2018 7:48 am",the tree is dead and there is a huge limb that is dead hanging over the road. citizen needs exact address will call back,,,,,
https://www.rva311.com/rvaone/Requests/ViewRequestDetail?requestId=DPW000007719&type=new_cs180220201343&viewRole=,DPW000007719,Assigned,"September 17, 2018 2:07 am","The curve in front of 600 Cowardin Ave has many accidents with vehicles running off the road. The property and pedestrians can be protected by simply adding a guardrail along the curve between the street and sidewalk. This simple fix would prevent out of control vehicles from running over trees, power poles, and people.",,,,,
https://www.rva311.com/rvaone/Requests/ViewRequestDetail?requestId=DPU000001710&type=new_cs180228212504&viewRole=,DPU000001710,Assigned,"September 16, 2018 9:47 pm","Corner of Sauer Ave & Grace Street, especially North East storm water basin. We residents cleared out 5 wheelbarrows of organic debris down to the first ladder rung. We could not clear any further because it is an impacted tree root system of an old Elm tree which is also dying of Dutch elm disease. Storm basin needs cleared using heavy equipment & ideally tree needs removed, it is also losing limbs.",,,,,
https://www.rva311.com/rvaone/Requests/ViewRequestDetail?requestId=DPW000007718&type=new_cs180301154109&viewRole=,DPW000007718,Assigned,"September 16, 2018 6:34 pm","Tree roots have dug up the bricks, making the sidewalk uneven and dangerous to pass.",,,,,
https://www.rva311.com/rvaone/Requests/ViewRequestDetail?requestId=DPW000007717&type=new_cs180301154109&viewRole=,DPW000007717,Assigned,"September 16, 2018 5:55 pm",The street sign at the intersection of Riverside Drive and Stratford Road is falling down. It now sits at a 45 degree angle.,,,,,
https://www.rva311.com/rvaone/Requests/ViewRequestDetail?requestId=DPW000007716&type=new_cs180221194251&viewRole=,DPW000007716,Completed,"September 16, 2018 4:38 pm",Traffic signal at left turn from laburnum onto Saunders is not working correctly. I observed it transition from red to no lit sections before briefly flashing green arrow and then yellow.,,,,,
https://www.rva311.com/rvaone/Requests/ViewRequestDetail?requestId=RPD000000281&type=new_cs180529151322&viewRole=,RPD000000281,Completed,"September 16, 2018 4:08 pm",Abandoned grey Oldsmobile Intrige VA tag (xvr-3738).,,,,,
https://www.rva311.com/rvaone/Requests/ViewRequestDetail?requestId=RPD000000280&type=new_cs180529151322&viewRole=,RPD000000280,Completed,"September 16, 2018 4:01 pm",White Chevrolet venture VA tag (XGB-6413). Abandoned on street with flat tires.,,,,,
https://www.rva311.com/rvaone/Requests/ViewRequestDetail?requestId=DPW000007715&type=new_cs180301154109&viewRole=,DPW000007715,Completed,"September 16, 2018 2:28 pm",There is a deep pothole at the intersection of Monument Avenue and Lafayette St. I hit the pothole. Now I am sitting in a parking lot waiting for AAA because I have a flat tire from the pothole.,,,,,
https://www.rva311.com/rvaone/Requests/ViewRequestDetail?requestId=DPW000007714&type=new_cs180301154109&viewRole=,DPW000007714,Assigned,"September 16, 2018 1:29 pm","Train tracks not in use and are a hazard for pedestrians, bikers, and cars traveling over and around for tripping, and may experience injury to car tires as well. No Parking signage needs repair to be understood clearly. Potholes all and dilapidation to sidewalk suffer greatly. Safety hazard in addition to creating unwarranted stigma of danger in corridor. Look forward to improvements acknowledged, enforced and completed per current code at minimum. Thank you.",,,,,
https://www.rva311.com/rvaone/Requests/ViewRequestDetail?requestId=DPW000007713&type=new_cs180301154109&viewRole=,DPW000007713,Completed,"September 16, 2018 12:29 pm",There is a deep pothole before the intersection of s. Shephard and idlewood heading towards 195. Cars have to swerve into incoming traffic to avoid it.,,,,,
https://www.rva311.com/rvaone/Requests/ViewRequestDetail?requestId=DPU000001709&type=new_cs180228212504&viewRole=,DPU000001709,Assigned,"September 16, 2018 11:58 am",The drainage basin at this intersection floods most times it rains. Many times covering half the road. The picture is facing the 195 overpass from the VCU garage.,,,,,
https://www.rva311.com/rvaone/Requests/ViewRequestDetail?requestId=RPD000000279&type=new_cs180529151322&viewRole=,RPD000000279,Completed,"September 16, 2018 9:54 am",gold Ford Explorer-JWR3553 Dark grey Ford Mustang-98323 Silver Ford Mustang- 93252 Abandoned in front of my house for 6 months now.,,,,,
https://www.rva311.com/rvaone/Requests/ViewRequestDetail?requestId=DPW000007711&type=new_cs180221194032&viewRole=,DPW000007711,Assigned,"September 16, 2018 9:41 am",Alley between Willway and Westmoreland has washed out,,,,,
https://www.rva311.com/rvaone/Requests/ViewRequestDetail?requestId=DPW000007710&type=new_cs180220201343&viewRole=,DPW000007710,Assigned,"September 16, 2018 9:13 am",Alley washed out.,,,,,
https://www.rva311.com/rvaone/Requests/ViewRequestDetail?requestId=DPW000007709&type=new_cs180221192758&viewRole=,DPW000007709,Assigned,"September 16, 2018 9:04 am",Yard waste in alley behind 811 w 29th street need to be picked up,,,,,
https://www.rva311.com/rvaone/Requests/ViewRequestDetail?requestId=DPW000007708&type=new_cs180221194032&viewRole=,DPW000007708,Assigned,"September 16, 2018 6:19 am",Alley entrance between park and Patterson on Belmont in museum district has sunk so that car bumpers are dragging in the dip and water is always held there.,,,,,
https://www.rva311.com/rvaone/Requests/ViewRequestDetail?requestId=DPU000001708&type=new_cs180226204420&viewRole=,DPU000001708,Completed,"September 15, 2018 11:32 pm","Light in the middle of the 400 block of N 10th St is out, on the southbound side.",,,,,
https://www.rva311.com/rvaone/Requests/ViewRequestDetail?requestId=DPW000007707&type=new_cs180301154109&viewRole=,DPW000007707,Assigned,"September 15, 2018 11:12 pm",Bricks missing and unusable sidewalk,,,,,
https://www.rva311.com/rvaone/Requests/ViewRequestDetail?requestId=DPW000007706&type=new_cs180221192758&viewRole=,DPW000007706,Assigned,"September 15, 2018 10:23 pm",We cut up the branches as best we could and put them to the left of the driveway.,,,,,
https://www.rva311.com/rvaone/Requests/ViewRequestDetail?requestId=DPU000001707&type=new_cs180226204420&viewRole=,DPU000001707,Completed,"September 15, 2018 8:27 pm","Street lights out at 21st & Main and going north on 21st. With the recent shootings, this seems very unsafe on a weekend.",,,,,
https://www.rva311.com/rvaone/Requests/ViewRequestDetail?requestId=DPW000007704&type=new_cs180221194457&viewRole=,DPW000007704,Assigned,"September 15, 2018 6:33 pm",Road sign and stop sign tilting and obstructed by greenery.,,,,,
https://www.rva311.com/rvaone/Requests/ViewRequestDetail?requestId=DPW000007703&type=new_cs180221194656&viewRole=,DPW000007703,Assigned,"September 15, 2018 5:42 pm",The tree with dead limbs that was reported several months ago off of Stonewall Ave between 20th & 21st street caused damage to a vehicle parked within the parking lot at 2000 Riverside. One of the dead limbs fell on a vehicle on 9/15 at approximately 5PM. The tree still has dead limbs overhanging the sidewalk and the parking lot.,,,,,
https://www.rva311.com/rvaone/Requests/ViewRequestDetail?requestId=DPW000007702&type=new_cs180301154109&viewRole=,DPW000007702,Assigned,"September 15, 2018 5:29 pm","several feet of standing storm water always in front of two houses, including handicapped parking spot. there is a drain, but it doesn't go down, maybe because of how the road was repaved or tree roots.",,,,,
https://www.rva311.com/rvaone/Requests/ViewRequestDetail?requestId=DPW000007701&type=new_cs180221194457&viewRole=,DPW000007701,Assigned,"September 15, 2018 3:03 pm","Vegetation is growing onto the road at the corner of Cherokee and Arrowhead Roads. It is growing into the street of Arrowhead and it is difficult to drive past other cars. Also, vegetation along Cherokee Road, especially at intersections need trimming for visibility. Please take care of this on Cherokee between Huguenot and Forest Hill.",,,,,
https://www.rva311.com/rvaone/Requests/ViewRequestDetail?requestId=DPW000007700&type=new_cs180221194032&viewRole=,DPW000007700,Assigned,"September 15, 2018 2:27 pm",The City gas company installed a gas line to my neighbor and dug up the alley - rear alley to 5410 New Kent and directly in the alley of 5417 Dorchester Rd. The hole was NOT filled properly and now is a mud hole! This is the second request for service - the first cannot be located. The first request was logged and assigned - now there is no record. Please put gravel and fill the hole and back fill the area so that the hole will no longer hold water and mud.,,,,,
https://www.rva311.com/rvaone/Requests/ViewRequestDetail?requestId=DPW000007699&type=new_cs180301154109&viewRole=,DPW000007699,Assigned,"September 15, 2018 2:09 pm",Sidewalk is in bad shape outside my home. My pregnant wife has tripped on these and many parents on strollers have to navigate around it. It's been eroded quite a bit and needs a concrete patch.,,,,,
https://www.rva311.com/rvaone/Requests/ViewRequestDetail?requestId=DPW000007698&type=new_cs180221194656&viewRole=,DPW000007698,Assigned,"September 15, 2018 12:55 pm","City tree blew over and destroyed curb and parts of sidewalk in March 2nd storm. City cut up and hauled away tree, leaving 6' stump leaning into street. City removed and ground stump in late July (see DPW000003589). The adjacent curb and walk are in a heap, and in need of repair. It may be that guidelines will prohibit planting of new tree due to possible sightline issues for drivers exiting the alley. In any case it's been over 6 months now since the storm-pls repair.",,,,,
https://www.rva311.com/rvaone/Requests/ViewRequestDetail?requestId=DPW000007697&type=new_cs180301154109&viewRole=,DPW000007697,Completed,"September 15, 2018 12:38 pm","It's a big, deep one!",,,,,
https://www.rva311.com/rvaone/Requests/ViewRequestDetail?requestId=DPW000007696&type=new_cs180221194656&viewRole=,DPW000007696,Assigned,"September 15, 2018 12:17 pm","Tree damaged / storm related....power company cut down tree, sections on edge of street & blocking driveway (some sections near the street but in our yard because no place to put tree sections without blocking street) Damaged tree downed by Dominion Power because of hurricane; blocking street.",,,,,
https://www.rva311.com/rvaone/Requests/ViewRequestDetail?requestId=DPU000001706&type=new_cs180228155543&viewRole=,DPU000001706,Assigned,"September 15, 2018 11:59 am",Sinkhole forming at storm sewer. Needs backfill.,,,,,
https://www.rva311.com/rvaone/Requests/ViewRequestDetail?requestId=DPW000007695&type=new_cs180301154109&viewRole=,DPW000007695,Completed,"September 15, 2018 11:38 am",Large pothole in front of 2230 Maplewood Ave. It’s been there all summer and has gotten worse.,,,,,
https://www.rva311.com/rvaone/Requests/ViewRequestDetail?requestId=DPW000007694&type=new_cs180221194032&viewRole=,DPW000007694,Assigned,"September 15, 2018 11:17 am",Alleys are in terrible condition. Enormous car-swallowing potholes! Standing water breading bugs! Both alleys bounded by Hanover and Stuart Aves between Roseneath and Tilden Rds. Last year's efforts were sub-par and alleys are as bad as ever.,,,,,
https://www.rva311.com/rvaone/Requests/ViewRequestDetail?requestId=DPW000007693&type=new_cs180301154109&viewRole=,DPW000007693,Completed,"September 15, 2018 11:06 am",Potholes on Belmont ave between Cary street and Grayland ave,,,,,
https://www.rva311.com/rvaone/Requests/ViewRequestDetail?requestId=DPW000007692&type=new_cs180301154109&viewRole=,DPW000007692,Completed,"September 15, 2018 10:55 am",Please fill the pothole on the 4200 block of Augusta Avenue,,,,,
https://www.rva311.com/rvaone/Requests/ViewRequestDetail?requestId=DPW000007691&type=new_cs180221194656&viewRole=,DPW000007691,Assigned,"September 15, 2018 10:52 am","Tree fell onto road and parked vehicle. No injuries. Tree is blocking the road and cut a power line, including street light. Wire may be hot, Dominion has been called. Road being blocked is Chantecler Ave between Hanover Ave and Wessex Lane, between 3 Chopt and Patterson, West of Libbie.",,,,,
https://www.rva311.com/rvaone/Requests/ViewRequestDetail?requestId=DPW000007690&type=new_cs180221194251&viewRole=,DPW000007690,Completed,"September 15, 2018 10:24 am",Left turn signal heading north on Belvedere off of Semmes is extremely short.,,,,,
https://www.rva311.com/rvaone/Requests/ViewRequestDetail?requestId=RPD000000278&type=new_cs180327173306&viewRole=,RPD000000278,Completed,"September 15, 2018 9:11 am",Illegal dumping across Westwood from the dropped pin. The app won't allow me to drop a pin on the exact location. The app crashes when I try to upload a photo.,,,,,
https://www.rva311.com/rvaone/Requests/ViewRequestDetail?requestId=DPW000007689&type=new_cs180221192758&viewRole=,DPW000007689,Completed,"September 15, 2018 9:01 am","When I went to retrieve my recycling bin from the alley after the last collection, the only sign of it was a mangled wheel. May I please have a new recycling bin? Sorry for the misleading subject line, but the request system did not present any better options.",,,,,
https://www.rva311.com/rvaone/Requests/ViewRequestDetail?requestId=DPU000001705&type=new_cs180226204420&viewRole=,DPU000001705,Completed,"September 14, 2018 11:13 pm",Streetlight in front of 6730 Stuart Ave is out,,,,,
https://www.rva311.com/rvaone/Requests/ViewRequestDetail?requestId=DPW000007688&type=new_cs180221194032&viewRole=,DPW000007688,Assigned,"September 14, 2018 5:56 pm",Alley has pond size puddles that stayed filled with water for weeks and it has become a sewagelike breeding ground for mosquitoes. Badly needs to be filled with gravel and grated.,,,,,
https://www.rva311.com/rvaone/Requests/ViewRequestDetail?requestId=DPU000001704&type=new_cs180228212504&viewRole=,DPU000001704,Assigned,"September 14, 2018 5:00 pm",Storm Drain is clogged on the corner of Grove and Woodlawn.,,,,,
https://www.rva311.com/rvaone/Requests/ViewRequestDetail?requestId=DPW000007686&type=new_cs180221194656&viewRole=,DPW000007686,Assigned,"September 14, 2018 4:37 pm",This tree is completely dead that's in front of this location please remove.,,,,,
https://www.rva311.com/rvaone/Requests/ViewRequestDetail?requestId=DPW000007685&type=new_cs180301154109&viewRole=,DPW000007685,Completed,"September 14, 2018 4:34 pm",Please schedule Grove and Thompson avenues for a pot hole repair. It is huge. A1B1,,,,,
https://www.rva311.com/rvaone/Requests/ViewRequestDetail?requestId=DPU000001703&type=new_cs180228212504&viewRole=,DPU000001703,Assigned,"September 14, 2018 4:26 pm",drainage by his home when it rains it starts a flood on his street,,,,,
https://www.rva311.com/rvaone/Requests/ViewRequestDetail?requestId=DPW000007683&type=new_cs180221194656&viewRole=,DPW000007683,Assigned,"September 14, 2018 4:03 pm",Tree has rotten roots and it is dead.,,,,,
https://www.rva311.com/rvaone/Requests/ViewRequestDetail?requestId=DPW000007682&type=new_cs180221194656&viewRole=,DPW000007682,Assigned,"September 14, 2018 3:58 pm",Tree ID: 86759 and 86758 - caller requests pruning.,,,,,
https://www.rva311.com/rvaone/Requests/ViewRequestDetail?requestId=DPW000007680&type=new_cs180301154109&viewRole=,DPW000007680,Completed,"September 14, 2018 3:56 pm",Caller states tree roots are causing damage to the brick driveway. - she states the COR is responsible for this portion of her driveway.,,,,,
https://www.rva311.com/rvaone/Requests/ViewRequestDetail?requestId=DPW000007679&type=new_cs180301154109&viewRole=,DPW000007679,Assigned,"September 14, 2018 3:49 pm",drive way entrance and sidewalk at driveway has buckled and i am afraid someone may trip and fall,,,,,
https://www.rva311.com/rvaone/Requests/ViewRequestDetail?requestId=DPU000001702&type=new_cs180228212504&viewRole=,DPU000001702,Assigned,"September 14, 2018 3:29 pm",Mother report from the Windsor Farms area that residents believe catch basins are blocked at Sulgrave and Clovelly Road. Phot of one sent shows it’s visibly impacted with mid. Believe this may be a problem throughout the area,,,,,
https://www.rva311.com/rvaone/Requests/ViewRequestDetail?requestId=DPW000007678&type=new_cs180301154109&viewRole=,DPW000007678,Completed,"September 14, 2018 3:23 pm",Pot holes on 3000 and 3100 block of Garland Ave,,,,,
https://www.rva311.com/rvaone/Requests/ViewRequestDetail?requestId=DPW000007677&type=new_cs180301154109&viewRole=,DPW000007677,Completed,"September 14, 2018 3:22 pm",Potholes on 3300 block of North Ave,,,,,
https://www.rva311.com/rvaone/Requests/ViewRequestDetail?requestId=DPW000007676&type=new_cs180221194656&viewRole=,DPW000007676,Assigned,"September 14, 2018 3:12 pm",Citizen states that this near is located in front of the property near the corner; it is a very large tree and is dropping lots of dead branches; tree may be dying; requests to have the tree assessed,,,,,
https://www.rva311.com/rvaone/Requests/ViewRequestDetail?requestId=DPW000007675&type=new_cs180301154109&viewRole=,DPW000007675,Completed,"September 14, 2018 2:58 pm",2 potholes on the street,,,,,
https://www.rva311.com/rvaone/Requests/ViewRequestDetail?requestId=DPW000007671&type=new_cs180221194656&viewRole=,DPW000007671,Assigned,"September 14, 2018 2:33 pm","Tree in front of 1407 Sauer Ave is losing large limbs, and is leaning over two houses. I would like this tree to be checked for health, and also trimmed back. - See more at: https://www.rva311.com/rvaone/Requests/ViewRequestDetail?requestId=DPW000006687&type=new_cs180221194656&viewRole=#sthash.cyZWoKqm.dpuf",,,,,
https://www.rva311.com/rvaone/Requests/ViewRequestDetail?requestId=DPU000001700&type=new_cs180228212504&viewRole=,DPU000001700,Assigned,"September 14, 2018 2:28 pm",Basins on both sides of rd have been clogged a long time. Many neighbors have complained for many months,,,,,
https://www.rva311.com/rvaone/Requests/ViewRequestDetail?requestId=RPD000000277&type=new_cs180327173306&viewRole=,RPD000000277,Completed,"September 14, 2018 2:08 pm",resident is stating that the neighbors behind her are throwing their trash in her back yard. like diapers and couches and she wants to get this settled before they start throwing away anything else. there are a couple of snakes and she just want to get this problem settled,,,,,
https://www.rva311.com/rvaone/Requests/ViewRequestDetail?requestId=RPD000000276&type=new_cs180529151350&viewRole=,RPD000000276,Completed,"September 14, 2018 2:01 pm","Multiple vehicles parked in bus stop lane on Grove at Seneca, SE corner. ongoing issue by employees in shops.",,,,,
https://www.rva311.com/rvaone/Requests/ViewRequestDetail?requestId=RPD000000275&type=new_cs180327173306&viewRole=,RPD000000275,Completed,"September 14, 2018 1:27 pm","Brush, discarded furniture? in front of 3021 Ellwood Ave",,,,,
https://www.rva311.com/rvaone/Requests/ViewRequestDetail?requestId=DPU000001699&type=new_cs180228212504&viewRole=,DPU000001699,Assigned,"September 14, 2018 1:25 pm",There is so much debris in basin that is floods street a lot you cant even see the road,,,,,
https://www.rva311.com/rvaone/Requests/ViewRequestDetail?requestId=DPW000007664&type=new_cs180301154109&viewRole=,DPW000007664,Assigned,"September 14, 2018 1:12 pm","**This sidewalk has caused falls by 2 elderly women in the last week!!** Needs to be fixed immediately. Sidewalk is raised due to what appears to be tree roots. That is dangerous, as well as the flooding of water that results on the lower side of the sidewalk. This creates a layer of slick mud on that part of the sidewalk and I have personally slipped on it. Imagine someone jogging that slides on this mud...instant injury lawsuit. This sidewalk is a huge liability and I will be reaching out to Councilman Hilbert as well regarding the issue, because surely someone else is going to be injured by this soon. Take the tree out if you need, just fix the sidewalk please!",,,,,
https://www.rva311.com/rvaone/Requests/ViewRequestDetail?requestId=DPU000001698&type=new_cs180228212504&viewRole=,DPU000001698,Assigned,"September 14, 2018 12:13 pm",Citizen states her ditch/drain in front of the house is clogged; please clean,,,,,
https://www.rva311.com/rvaone/Requests/ViewRequestDetail?requestId=DPW000007657&type=new_cs180301154109&viewRole=,DPW000007657,Assigned,"September 14, 2018 11:46 am",Sidewalk has been uprooted by trees growing along the city easement. 3904-3906 Sulgrave. Residents concerned over the danger of elderly residents falling due to sidewalk. Requesting repair.,,,,,
https://www.rva311.com/rvaone/Requests/ViewRequestDetail?requestId=DPW000007656&type=new_cs180301154109&viewRole=,DPW000007656,Completed,"September 14, 2018 11:43 am",The Street at this location was half paved there is a steal plate in the street that's blocking the drain from curb to gutter causing a backup need the plate removed and the other half of the street repaved please investigate.,,,,,
https://www.rva311.com/rvaone/Requests/ViewRequestDetail?requestId=DPW000007655&type=new_cs180221194656&viewRole=,DPW000007655,Assigned,"September 14, 2018 11:40 am",tree is split down the middle and the citizen is worried that it fall on cars if storm hits and would like to have removed. having been calling about the tree for months.,,,,,
https://www.rva311.com/rvaone/Requests/ViewRequestDetail?requestId=DPW000007654&type=new_cs180221194032&viewRole=,DPW000007654,Assigned,"September 14, 2018 11:29 am",There is a huge pothole in the alley behind this location alley need to gravel asap,,,,,
https://www.rva311.com/rvaone/Requests/ViewRequestDetail?requestId=DPW000007652&type=new_cs180221192758&viewRole=,DPW000007652,Completed,"September 14, 2018 11:13 am",Trash was not picked up behind my residence this week.,,,,,
https://www.rva311.com/rvaone/Requests/ViewRequestDetail?requestId=DPW000007651&type=new_cs180301154109&viewRole=,DPW000007651,Completed,"September 14, 2018 11:09 am",the sink hole needs to be filled in,,,,,
https://www.rva311.com/rvaone/Requests/ViewRequestDetail?requestId=DPW000007650&type=new_cs180301154109&viewRole=,DPW000007650,Assigned,"September 14, 2018 11:09 am",resident is calling in because they is a big hump in the middle of the street and she doesn't know if a pipe is rising up or if trucks keep bumping it. need someone to come out because if a car hits it she know its going to cause some serious damage,,,,,
https://www.rva311.com/rvaone/Requests/ViewRequestDetail?requestId=DPU000001697&type=new_cs180226204420&viewRole=,DPU000001697,Completed,"September 14, 2018 11:06 am",The light in the alley needs to be repaired,,,,,
https://www.rva311.com/rvaone/Requests/ViewRequestDetail?requestId=DPW000007644&type=new_cs180221194656&viewRole=,DPW000007644,Assigned,"September 14, 2018 10:13 am",Citizen called regarding a limb that has fallen down blocking Monticello St. Please follow up.,,,,,
https://www.rva311.com/rvaone/Requests/ViewRequestDetail?requestId=DPW000007643&type=new_cs180301154109&viewRole=,DPW000007643,Completed,"September 14, 2018 10:12 am",large pot hole,,,,,
https://www.rva311.com/rvaone/Requests/ViewRequestDetail?requestId=DPW000007641&type=new_cs180221192758&viewRole=,DPW000007641,Assigned,"September 14, 2018 10:01 am","Three piles of limbs and brush from trimming bushes off sidewalks as mandated by City, piles in median on west side of Brook Rd between side of 1201 Confederate Ave and alley.",,,,,
https://www.rva311.com/rvaone/Requests/ViewRequestDetail?requestId=DPU000001696&type=new_cs180228212504&viewRole=,DPU000001696,Completed,"September 14, 2018 9:35 am",Stormwater drains at Exeter Road and Oxford Circle reported as not draining,,,,,
https://www.rva311.com/rvaone/Requests/ViewRequestDetail?requestId=DPU000001695&type=new_cs180221191708&viewRole=,DPU000001695,Completed,"September 14, 2018 9:34 am",the light is out in the alley afraid of that would cause robberies,,,,,
