Service Request URL,Service Request,Status,Request Date,Description,,,,,
https://www.rva311.com/rvaone/Requests/ViewRequestDetail?requestId=DPU000001548&type=new_cs180228212504&viewRole=,DPU000001548,Completed,"September 10, 2018 2:05 pm",Back yard storm drain flooding - photo attached. Metal grated drain floods substantially during rain and could cause home flooding with upcoming hurricane. Surrounding yards also drain in to this basin.,,,,,
https://www.rva311.com/rvaone/Requests/ViewRequestDetail?requestId=DPU000001547&type=new_cs180301142929&viewRole=,DPU000001547,Completed,"September 10, 2018 2:01 pm",Flooding in backyard due to blocked storm drain. 4 yards surround drain in to my yard. Will be emergency situation with possible flooding of home if not repaired before hurricane rains this week.,,,,,
https://www.rva311.com/rvaone/Requests/ViewRequestDetail?requestId=DPU000001546&type=new_cs180228212504&viewRole=,DPU000001546,Completed,"September 10, 2018 1:55 pm",citizen requesting to have storm drain cleaned because when it rains it floods very badly,,,,,
https://www.rva311.com/rvaone/Requests/ViewRequestDetail?requestId=DPW000007279&type=new_cs180221192758&viewRole=,DPW000007279,Assigned,"September 10, 2018 1:53 pm","Broken tree branches lying on sidewalk along back of post office, opposite 408 N. 24th St., 23223. Also sidewalk covered with weeds, not maintained.",,,,,
https://www.rva311.com/rvaone/Requests/ViewRequestDetail?requestId=DPW000007278&type=new_cs180221194423&viewRole=,DPW000007278,Assigned,"September 10, 2018 1:48 pm",Yellow sign down in traffic circle at Floyd and Belmont.,,,,,
https://www.rva311.com/rvaone/Requests/ViewRequestDetail?requestId=DPU000001545&type=new_cs180228212504&viewRole=,DPU000001545,Assigned,"September 10, 2018 1:41 pm",would like to know if someone can come and check the drain by his home to see if it needs cleaning,,,,,
https://www.rva311.com/rvaone/Requests/ViewRequestDetail?requestId=DPW000007275&type=new_cs180301154109&viewRole=,DPW000007275,Assigned,"September 10, 2018 1:36 pm",Very bad sidewalk damage and unevenness due to tree roots -- hazardous for walking. This is the second or third request I've submitted over several years. We've been waiting a LONG time!,,,,,
https://www.rva311.com/rvaone/Requests/ViewRequestDetail?requestId=DPW000007273&type=new_cs180221194656&viewRole=,DPW000007273,Assigned,"September 10, 2018 1:30 pm",Citizen called stating the branches are falling onto her fence and yard. She is concern with upcoming weather. She said someone came out to look at the tree 2 1/2 weeks ago but she haven't heard back.,,,,,
https://www.rva311.com/rvaone/Requests/ViewRequestDetail?requestId=DPW000007272&type=new_cs180221194656&viewRole=,DPW000007272,Assigned,"September 10, 2018 1:28 pm",2 dead trees in home that need to be removed,,,,,
https://www.rva311.com/rvaone/Requests/ViewRequestDetail?requestId=DPU000001544&type=new_cs180228212504&viewRole=,DPU000001544,Completed,"September 10, 2018 1:24 pm",unsure whats in the drain to cause the flooding when it rains needs to be cleaned out,,,,,
https://www.rva311.com/rvaone/Requests/ViewRequestDetail?requestId=DPW000007269&type=new_cs180221194656&viewRole=,DPW000007269,Assigned,"September 10, 2018 1:22 pm",citizen states tree is dead need to be cut down and limbs on tree keep falling,,,,,
https://www.rva311.com/rvaone/Requests/ViewRequestDetail?requestId=DPW000007270&type=new_cs180221192758&viewRole=,DPW000007270,Completed,"September 10, 2018 1:22 pm","2 weeks ago, the trash people knocked the wheels off my already beat up trash can. That day I put in a request for a new can. I don't see that request here and I have no trash can yet. Come on people. It can't be this hard. Please bring me a new can!",,,,,
https://www.rva311.com/rvaone/Requests/ViewRequestDetail?requestId=DPU000001543&type=new_cs180228212904&viewRole=,DPU000001543,Assigned,"September 10, 2018 1:03 pm",Caller states the ditches are clogged and this will cause water to flood the area during the storm.,,,,,
https://www.rva311.com/rvaone/Requests/ViewRequestDetail?requestId=DPW000007268&type=new_cs180221192758&viewRole=,DPW000007268,Completed,"September 10, 2018 1:03 pm",Alley between 1900 block of Stuart and Hanover. Trash has not been picked up for two weeks.,,,,,
https://www.rva311.com/rvaone/Requests/ViewRequestDetail?requestId=DPU000001542&type=new_cs180228212504&viewRole=,DPU000001542,Assigned,"September 10, 2018 12:59 pm",citizen states with the last big storm the street old locke lane flooded very badly due to overgrowth of vegetation and debri.. drainage currently has over growth and limbs that needs to be removed in a hurry before next major storm or the location,,,,,
https://www.rva311.com/rvaone/Requests/ViewRequestDetail?requestId=DPU000001541&type=new_cs180228212904&viewRole=,DPU000001541,Assigned,"September 10, 2018 12:58 pm",Creek behind home floods homes and messes up cars. Creek and ditch need to be cleaned out 2500 block****,,,,,
https://www.rva311.com/rvaone/Requests/ViewRequestDetail?requestId=DPW000007266&type=new_cs180221194656&viewRole=,DPW000007266,Assigned,"September 10, 2018 12:53 pm",We have a large oak tree which has some dead branches hanging over the road and near our walkway. We are requesting these tree limbs be removed as soon as possible. Thank you!,,,,,
https://www.rva311.com/rvaone/Requests/ViewRequestDetail?requestId=DPU000001540&type=new_cs180226204420&viewRole=,DPU000001540,Completed,"September 10, 2018 12:51 pm",Street light is out in front of 1108 w Franklin st,,,,,
https://www.rva311.com/rvaone/Requests/ViewRequestDetail?requestId=DPW000007265&type=new_cs180221192758&viewRole=,DPW000007265,Assigned,"September 10, 2018 12:48 pm",Tire in alley behind garage left by previous iwner,,,,,
https://www.rva311.com/rvaone/Requests/ViewRequestDetail?requestId=DPW000007264&type=new_cs180301154109&viewRole=,DPW000007264,Assigned,"September 10, 2018 12:47 pm",Citizen called to report sidewalk that is lifting due to tree roots.,,,,,
https://www.rva311.com/rvaone/Requests/ViewRequestDetail?requestId=DPW000007262&type=new_cs180221194656&viewRole=,DPW000007262,Assigned,"September 10, 2018 12:37 pm",tree had died and limbs and been dropping in yard. citizen tired of them cutting ac branches off and wants to tree removed . She afraid new storm can cased the tree to fall on house. some of the tree fell and damaged the fence of citizen,,,,,
https://www.rva311.com/rvaone/Requests/ViewRequestDetail?requestId=DPW000007261&type=new_cs180221194656&viewRole=,DPW000007261,Assigned,"September 10, 2018 12:36 pm",limbs are hanging over citizens home and would like to have them removed before the hurricane. would like to have the tree examined due to all of the fungus growing,,,,,
https://www.rva311.com/rvaone/Requests/ViewRequestDetail?requestId=DPW000007260&type=new_cs180221194656&viewRole=,DPW000007260,Assigned,"September 10, 2018 12:36 pm",Tree damaged by previous storms and is now hanging over property and power lines to houses (111 - 119 N. Shields Av.) Tree is on city property in alley.,,,,,
https://www.rva311.com/rvaone/Requests/ViewRequestDetail?requestId=DPW000007258&type=new_cs180301154109&viewRole=,DPW000007258,Completed,"September 10, 2018 12:31 pm",the two potholes that are larger,,,,,
https://www.rva311.com/rvaone/Requests/ViewRequestDetail?requestId=DPW000007256&type=new_cs180221192758&viewRole=,DPW000007256,Completed,"September 10, 2018 12:27 pm",Caller states his trash was missed last week; he called on Friday and was told it would be picked up on Saturday but it was not picked up; please collect trash,,,,,
https://www.rva311.com/rvaone/Requests/ViewRequestDetail?requestId=DPW000007255&type=new_cs180221194457&viewRole=,DPW000007255,Assigned,"September 10, 2018 12:25 pm",you can see to bus stop,,,,,
https://www.rva311.com/rvaone/Requests/ViewRequestDetail?requestId=DPW000007254&type=new_cs180221194032&viewRole=,DPW000007254,Assigned,"September 10, 2018 12:24 pm","This alley has pot holes and I called several months ago I have made several calls about this and still nothing , it’s tearing up my truck . This is not fair , this alley needs to be fixed before bad weather set in .",,,,,
https://www.rva311.com/rvaone/Requests/ViewRequestDetail?requestId=DPW000007251&type=new_cs180221194656&viewRole=,DPW000007251,Assigned,"September 10, 2018 12:11 pm",Citizen stated there are three trees that have been dropping limbs down. One tree has a limb that has fallen between utility lines.,,,,,
https://www.rva311.com/rvaone/Requests/ViewRequestDetail?requestId=DPU000001539&type=new_cs180228212504&viewRole=,DPU000001539,Completed,"September 10, 2018 12:00 pm",When it rains the drainage is so clogged it lands on customer property and stays on property until the rain stops. This is an on going problem. Customer would like a call when an inspector can come out to look at this drain.,,,,,
https://www.rva311.com/rvaone/Requests/ViewRequestDetail?requestId=DPU000001538&type=new_cs180301142929&viewRole=,DPU000001538,Completed,"September 10, 2018 11:59 am",There is standing water at the end of Elmsmere Avenue and Rosedale along the interstate barrier. - See more at:,,,,,
https://www.rva311.com/rvaone/Requests/ViewRequestDetail?requestId=DPW000007247&type=new_cs180221194656&viewRole=,DPW000007247,Assigned,"September 10, 2018 11:46 am",tree limb down about 6ft,,,,,
https://www.rva311.com/rvaone/Requests/ViewRequestDetail?requestId=DPW000007246&type=new_cs180221194656&viewRole=,DPW000007246,Assigned,"September 10, 2018 11:45 am",low hanging tree limb,,,,,
https://www.rva311.com/rvaone/Requests/ViewRequestDetail?requestId=DPW000007244&type=new_cs180221194656&viewRole=,DPW000007244,Assigned,"September 10, 2018 11:40 am",half of the tree is dead on the property line,,,,,
https://www.rva311.com/rvaone/Requests/ViewRequestDetail?requestId=DPU000001537&type=new_cs180228212504&viewRole=,DPU000001537,Assigned,"September 10, 2018 11:32 am","people have been throwing leaves, trash, glass , tarps , the last time it rained it flooded his shop, it causes his back yard all the time and it a huge storm sewer, Trying to fix before hurricane hit Richmond VA he would like a call back",,,,,
https://www.rva311.com/rvaone/Requests/ViewRequestDetail?requestId=DPU000001536&type=new_cs180226204420&viewRole=,DPU000001536,Completed,"September 10, 2018 11:32 am",Street lights out on the 3200 and 3300 blocks of P Street,,,,,
https://www.rva311.com/rvaone/Requests/ViewRequestDetail?requestId=DPW000007241&type=new_cs180221194032&viewRole=,DPW000007241,Completed,"September 10, 2018 11:26 am",Clean and gravel alley way,,,,,
https://www.rva311.com/rvaone/Requests/ViewRequestDetail?requestId=DPW000007240&type=new_cs180221194656&viewRole=,DPW000007240,Assigned,"September 10, 2018 11:22 am",tree is hanging over the property and it looks like its about to fall. resident is concerned because with all the weather that is coming she wants to make sure this tree is looked at and the proper steps are taken before anything happens,,,,,
https://www.rva311.com/rvaone/Requests/ViewRequestDetail?requestId=DPW000007239&type=new_cs180221194457&viewRole=,DPW000007239,Assigned,"September 10, 2018 11:21 am","Overgrown brush covering the sidewalk. Many small children have to walk in the street to get around it. Multiple neighbors including myself, have logged this complaint before. Please have the decency to at least respond to your tax paying, law abiding citizens.",,,,,
https://www.rva311.com/rvaone/Requests/ViewRequestDetail?requestId=DPU000001534&type=new_cs180228212504&viewRole=,DPU000001534,Completed,"September 10, 2018 11:20 am",There is standing water at the end of Elmsmere Avenue and Rosedale along the interstate barrier.,,,,,
https://www.rva311.com/rvaone/Requests/ViewRequestDetail?requestId=DPU000001533&type=new_cs180226204420&viewRole=,DPU000001533,Completed,"September 10, 2018 11:19 am",Caller states there are two streetlights out; needs repair,,,,,
https://www.rva311.com/rvaone/Requests/ViewRequestDetail?requestId=DPW000007238&type=new_cs180221194656&viewRole=,DPW000007238,Assigned,"September 10, 2018 11:19 am",Tree is growing in power lines need to be trimmed,,,,,
https://www.rva311.com/rvaone/Requests/ViewRequestDetail?requestId=DPU000001532&type=new_cs180228212504&viewRole=,DPU000001532,Completed,"September 10, 2018 11:19 am",storm water drain is not draining and the street is flooded. This looks worrisome given the upcoming storms.,,,,,
https://www.rva311.com/rvaone/Requests/ViewRequestDetail?requestId=DPU000001531&type=new_cs180226204420&viewRole=,DPU000001531,Completed,"September 10, 2018 11:18 am",Caller states the street light is out in the alley; please repair,,,,,
https://www.rva311.com/rvaone/Requests/ViewRequestDetail?requestId=DPW000007237&type=new_cs180301154109&viewRole=,DPW000007237,Assigned,"September 10, 2018 11:14 am","Curb/drainage severely eroded and damaged; asphalt/macadam severely deteriorated and crumbled away by 12"" or more and continues to worsen. Please replace asphalt to improve drainage and curb/street maintenance",,,,,
https://www.rva311.com/rvaone/Requests/ViewRequestDetail?requestId=DPU000001530&type=new_cs180228212504&viewRole=,DPU000001530,Assigned,"September 10, 2018 11:09 am",trash from up the street flows down and into drain causing drain to clog for 1800 Joplin and 1801 Joplin ave. a request was previously submitted in June but wasn't assigned to department 101000122994,,,,,
https://www.rva311.com/rvaone/Requests/ViewRequestDetail?requestId=DPW000007235&type=new_cs180221192758&viewRole=,DPW000007235,Assigned,"September 10, 2018 11:08 am",TRASH HAS BEEN AT THE CORNER OF 29TH and M STREETS FOR 2.5 MONTHS IT IS THE RESPONSIBILITY OF PARKS AND RECREATION. PLEASE WE RETRIEVE IT MICE ARE IN THE AREA AND ITS NEAR A SCHOOL,,,,,
https://www.rva311.com/rvaone/Requests/ViewRequestDetail?requestId=DPW000007234&type=new_cs180221194656&viewRole=,DPW000007234,Assigned,"September 10, 2018 11:08 am",filling out a application,,,,,
https://www.rva311.com/rvaone/Requests/ViewRequestDetail?requestId=DPW000007233&type=new_cs180221194656&viewRole=,DPW000007233,Assigned,"September 10, 2018 11:02 am",tree fell. they come and got the tree but left the roots open and also left a big hole in the group,,,,,
https://www.rva311.com/rvaone/Requests/ViewRequestDetail?requestId=DPW000007231&type=new_cs180221194656&viewRole=,DPW000007231,Assigned,"September 10, 2018 11:00 am",there is a limb hanging over the side walk. a request has been put in a year ago. and he just want to make sure someone take a look at it before it does fall on there car,,,,,
https://www.rva311.com/rvaone/Requests/ViewRequestDetail?requestId=DPU000001528&type=new_cs180301142929&viewRole=,DPU000001528,Assigned,"September 10, 2018 10:57 am",Customer states that the basin is clogged between Lynhaven and Columbia street in the 2400 block,,,,,
https://www.rva311.com/rvaone/Requests/ViewRequestDetail?requestId=DPW000007230&type=new_cs180221192758&viewRole=,DPW000007230,Completed,"September 10, 2018 10:56 am","This is my third time requesting a supercan for 3153 Ellwood Ave Apt A. I was previously given DPW000004997 as a request number but it doesn't show up as a request on this site... I have been putting my trash in the alleyway next to the trashcan like I was told to by DPW, but that trash doesn't get picked up. I don't understand why I'm paying for a service that I'm not even able to use. Please bring me a can.",,,,,
https://www.rva311.com/rvaone/Requests/ViewRequestDetail?requestId=DPW000007229&type=new_cs180221192758&viewRole=,DPW000007229,Completed,"September 10, 2018 10:53 am",The trash can is missing the lid. We asked for a replacement two months ago but haven't heard anything. The trash can is currently located behind the shed in the backyard. We can move it to the street if we know it's going to be picked up.,,,,,
https://www.rva311.com/rvaone/Requests/ViewRequestDetail?requestId=DPW000007228&type=new_cs180221194656&viewRole=,DPW000007228,Assigned,"September 10, 2018 10:53 am","Tree maintenance is need at 3404 Montrose Ave, the tree in the front of my property is loosing a lot of branches in the street and close to the cars. Also in the rear alley the trees are going into the lines . I am not sure what service provide this is connected to.",,,,,
https://www.rva311.com/rvaone/Requests/ViewRequestDetail?requestId=DPW000007226&type=new_cs180221194656&viewRole=,DPW000007226,Assigned,"September 10, 2018 10:44 am",Tree fell there are tons of bushes in a curve at the end of road,,,,,
https://www.rva311.com/rvaone/Requests/ViewRequestDetail?requestId=DPW000007223&type=new_cs180221194656&viewRole=,DPW000007223,Assigned,"September 10, 2018 10:42 am",resident is calling in because he has been calling in about this same tree and the case was closed for this case #101000124472. limb broke his car window and since that storm is coming he wants to make sure it handled.,,,,,
https://www.rva311.com/rvaone/Requests/ViewRequestDetail?requestId=DPU000001527&type=new_cs180226204420&viewRole=,DPU000001527,Completed,"September 10, 2018 10:39 am",Light out on side of address on S St.,,,,,
https://www.rva311.com/rvaone/Requests/ViewRequestDetail?requestId=DPU000001526&type=new_cs180228212504&viewRole=,DPU000001526,Assigned,"September 10, 2018 10:38 am","Basin in north end of battery park completely filled, needs to be cleaned out - area floods in heavy rain.",,,,,
https://www.rva311.com/rvaone/Requests/ViewRequestDetail?requestId=DPU000001525&type=new_cs180228212504&viewRole=,DPU000001525,Assigned,"September 10, 2018 10:36 am",Caller states the drains are very clogged and it is causing standing water - caller is very concerned about the potential flooding due to the hurricane.,,,,,
https://www.rva311.com/rvaone/Requests/ViewRequestDetail?requestId=DPW000007221&type=new_cs180221192758&viewRole=,DPW000007221,Completed,"September 10, 2018 10:28 am",Bulk trash pickup missed. Storm coming and tons and tons of trash in our alley. Big huge bedroom stuff that will damage things during a hurricane,,,,,
https://www.rva311.com/rvaone/Requests/ViewRequestDetail?requestId=DPW000007220&type=new_cs180221194656&viewRole=,DPW000007220,Assigned,"September 10, 2018 10:23 am",2 Tree a round the playground need to be cut,,,,,
https://www.rva311.com/rvaone/Requests/ViewRequestDetail?requestId=DPU000001524&type=new_cs180228212504&viewRole=,DPU000001524,Assigned,"September 10, 2018 10:13 am","Broken down leaves and silt have blocked our storm drain on the southside of Avondale Ave. This is caused by improperly graded street that allows water to sit in the street, colelcting debris, When larger storms come, those debris clog the basin.",,,,,
https://www.rva311.com/rvaone/Requests/ViewRequestDetail?requestId=DPU000001523&type=new_cs180228212904&viewRole=,DPU000001523,Assigned,"September 10, 2018 10:13 am","Citizen called regarding storm drain that is backed up, which causes the street to back up",,,,,
https://www.rva311.com/rvaone/Requests/ViewRequestDetail?requestId=DPU000001522&type=new_cs180228212504&viewRole=,DPU000001522,Completed,"September 10, 2018 10:10 am","Street sewer drain has been clogged all summer, despite numerous neighbor requests for service. Water floods the street corner at Nottoway Ave. and Mt. Vernon Avenue almost covering the entire street corner.",,,,,
https://www.rva311.com/rvaone/Requests/ViewRequestDetail?requestId=DPW000007218&type=new_cs180221194656&viewRole=,DPW000007218,Assigned,"September 10, 2018 10:09 am","In reference to ticket DPW000007137, the gum tree in front of 4400 Leonard needs to be maintained. As previously stated, the top half of the tree fell into the road on 9/7 during the storm leaving a large exposed portion of the trunk which may lead to rot. We would like to have this inspected due to the upcoming storms.",,,,,
https://www.rva311.com/rvaone/Requests/ViewRequestDetail?requestId=DPW000007217&type=new_cs180221194656&viewRole=,DPW000007217,Assigned,"September 10, 2018 10:08 am",trees have limbs that are constantly falling,,,,,
https://www.rva311.com/rvaone/Requests/ViewRequestDetail?requestId=DPW000007215&type=new_cs180221194656&viewRole=,DPW000007215,Assigned,"September 10, 2018 9:55 am",City tree dropped large dead limb during 9/7/18 storm onto front walkway and landscape. I removed and put into alley for pickup but worry about more dead limbs and house at risk in future storms.,,,,,
https://www.rva311.com/rvaone/Requests/ViewRequestDetail?requestId=RPD000000265&type=new_cs180327173306&viewRole=,RPD000000265,Completed,"September 10, 2018 9:53 am",construction material be dropped behind home,,,,,
https://www.rva311.com/rvaone/Requests/ViewRequestDetail?requestId=DPW000007211&type=new_cs180221194656&viewRole=,DPW000007211,Assigned,"September 10, 2018 9:38 am",Tree in front of home needs to be trimmed,,,,,
https://www.rva311.com/rvaone/Requests/ViewRequestDetail?requestId=RPD000000264&type=new_cs180529151322&viewRole=,RPD000000264,Completed,"September 10, 2018 9:37 am",Green Honda Accord - VCV2225 - inspection and tags expired last year - Car has been sitting there since June.,,,,,
https://www.rva311.com/rvaone/Requests/ViewRequestDetail?requestId=DPU000001519&type=new_cs180226204420&viewRole=,DPU000001519,Completed,"September 10, 2018 9:37 am",2 lights out on Mulberry between Grace and Monument,,,,,
https://www.rva311.com/rvaone/Requests/ViewRequestDetail?requestId=DPW000007210&type=new_cs180221194656&viewRole=,DPW000007210,Assigned,"September 10, 2018 9:32 am",2 trees in the front needs to be maintained,,,,,
https://www.rva311.com/rvaone/Requests/ViewRequestDetail?requestId=RPD000000263&type=new_cs180529151350&viewRole=,RPD000000263,Completed,"September 10, 2018 9:31 am",Boat parked on street for a month at 800 block of Roseneath Rd and at 3411 Wythe Ave,,,,,
https://www.rva311.com/rvaone/Requests/ViewRequestDetail?requestId=DPU000001518&type=new_cs180228212504&viewRole=,DPU000001518,Completed,"September 10, 2018 9:27 am",at the corner of dunston and w 47th on the even side of the street .. both basins are clogged with organic material one with organic material and trash looking to have cleared before hurricane hits,,,,,
https://www.rva311.com/rvaone/Requests/ViewRequestDetail?requestId=DPU000001517&type=new_cs180228212504&viewRole=,DPU000001517,Assigned,"September 10, 2018 9:21 am",Stormwater Drains at the corner of Dunston and W 47th are clogged,,,,,
https://www.rva311.com/rvaone/Requests/ViewRequestDetail?requestId=DPU000001516&type=new_cs180226204420&viewRole=,DPU000001516,Completed,"September 10, 2018 9:17 am",there is a street light out in front of home,,,,,
https://www.rva311.com/rvaone/Requests/ViewRequestDetail?requestId=DPU000001515&type=new_cs180226204420&viewRole=,DPU000001515,Completed,"September 10, 2018 9:16 am",there are street light in front of home that are out.,,,,,
https://www.rva311.com/rvaone/Requests/ViewRequestDetail?requestId=RPD000000262&type=new_cs180327173306&viewRole=,RPD000000262,Completed,"September 10, 2018 9:13 am",there are tires and washing machine,,,,,
https://www.rva311.com/rvaone/Requests/ViewRequestDetail?requestId=DPU000001514&type=new_cs180228212504&viewRole=,DPU000001514,Assigned,"September 10, 2018 9:12 am",Clogged storm drains need clearing ASAP. Sauer’s Garden has experienced devastating basement flooding from storm drain backups during previous hurricanes and tropical storms. Our storm drains are long overdue for clearing. Please try and clear them ahead of hurricane Flo. Thank you.,,,,,
https://www.rva311.com/rvaone/Requests/ViewRequestDetail?requestId=RPD000000261&type=new_cs180529151322&viewRole=,RPD000000261,Completed,"September 10, 2018 9:11 am",cars outside with no tags on them,,,,,
https://www.rva311.com/rvaone/Requests/ViewRequestDetail?requestId=DPU000001513&type=new_cs180226204420&viewRole=,DPU000001513,Completed,"September 10, 2018 9:09 am",street light is not need a bulb,,,,,
https://www.rva311.com/rvaone/Requests/ViewRequestDetail?requestId=DPW000007206&type=new_cs180221194656&viewRole=,DPW000007206,Assigned,"September 10, 2018 9:07 am",There are dead limbs hanging from the city tree that need to be trimmed at this location on the side street Sauer St. very dangerous citizen would like to meet you there. A1B1,,,,,
https://www.rva311.com/rvaone/Requests/ViewRequestDetail?requestId=DPW000007205&type=new_cs180221194656&viewRole=,DPW000007205,Assigned,"September 10, 2018 9:04 am",large limb feel and is blocking parking spaces,,,,,
https://www.rva311.com/rvaone/Requests/ViewRequestDetail?requestId=DPU000001512&type=new_cs180228212904&viewRole=,DPU000001512,Assigned,"September 10, 2018 9:02 am",New construction at 212 S Wilton has removed vegetation that was keeping water from flooding this resident's house - they built a retaining water but it has done nothing to prevent flood waters from accumulating on this property.,,,,,
https://www.rva311.com/rvaone/Requests/ViewRequestDetail?requestId=DPW000007204&type=new_cs180221194656&viewRole=,DPW000007204,Assigned,"September 10, 2018 9:01 am","trees are blocking traffic, they need to be trimmed all of the trees on the block",,,,,
https://www.rva311.com/rvaone/Requests/ViewRequestDetail?requestId=DPU000001511&type=new_cs180228212904&viewRole=,DPU000001511,Assigned,"September 10, 2018 8:45 am",resident is calling in because the drains under her neighbors drive way is totally backed up and her basement has flooded 2 times because of this. would like for someone to come out and clean out the drains before anymore damage takes place,,,,,
https://www.rva311.com/rvaone/Requests/ViewRequestDetail?requestId=DPW000007201&type=new_cs180221194656&viewRole=,DPW000007201,Assigned,"September 10, 2018 8:40 am",citizen states tree in front of property is splitting leaning towards citizen house,,,,,
