Service Request URL,Service Request,Status,Request Date,Description,,,,,
https://www.rva311.com/rvaone/Requests/ViewRequestDetail?requestId=DPW000008189&type=new_cs180221192758&viewRole=,DPW000008189,Assigned,"September 21, 2018 10:13 am",Second request. City tree limbs are down and blocking street drain,,,,,
https://www.rva311.com/rvaone/Requests/ViewRequestDetail?requestId=DPW000008188&type=new_cs180221192758&viewRole=,DPW000008188,Completed,"September 21, 2018 10:05 am",Caller states her trash was not picked up this week.,,,,,
https://www.rva311.com/rvaone/Requests/ViewRequestDetail?requestId=RPD000000296&type=new_cs180529151350&viewRole=,RPD000000296,Completed,"September 21, 2018 9:55 am","Parking violations happening at the intersection of Cary St and Belvidere St, along Cary headed from the fan towards downtown. This intersection has increased in traffic with VCU students back in school and with people parking in the right hand turn lane before 9 AM it creates major backups along Cary St and having to wait multiple rotations of the light to get through the intersection. The signs state no parking from 7-9 AM but the cars were not ticketed as such.",,,,,
https://www.rva311.com/rvaone/Requests/ViewRequestDetail?requestId=DPU000001845&type=new_cs180221191708&viewRole=,DPU000001845,Completed,"September 21, 2018 9:48 am",Would like to have light fixed because it is very dark and there is always a lot of traffic,,,,,
https://www.rva311.com/rvaone/Requests/ViewRequestDetail?requestId=DPW000008182&type=new_cs180221194656&viewRole=,DPW000008182,Assigned,"September 21, 2018 9:36 am",Tree is dead and need to be cut down.,,,,,
https://www.rva311.com/rvaone/Requests/ViewRequestDetail?requestId=DPU000001844&type=new_cs180301142929&viewRole=,DPU000001844,Assigned,"September 21, 2018 9:11 am",drain needs to be repaired again the last storm damaged it.,,,,,
https://www.rva311.com/rvaone/Requests/ViewRequestDetail?requestId=DPW000008180&type=new_cs180221194251&viewRole=,DPW000008180,Completed,"September 21, 2018 9:09 am",needs repair,,,,,
https://www.rva311.com/rvaone/Requests/ViewRequestDetail?requestId=DPU000001843&type=new_cs180226204420&viewRole=,DPU000001843,Completed,"September 21, 2018 8:46 am",Citizen states Light has been out for a long time at top of a Brick Pillar at intersection of W Cary and Westmoreland Place re: DPU000000776 ;,,,,,
https://www.rva311.com/rvaone/Requests/ViewRequestDetail?requestId=DPU000001842&type=new_cs180228212904&viewRole=,DPU000001842,Assigned,"September 21, 2018 8:31 am",citizen states when it rain there is standing water in the middle of the street,,,,,
https://www.rva311.com/rvaone/Requests/ViewRequestDetail?requestId=DPW000008174&type=new_cs180301154109&viewRole=,DPW000008174,Assigned,"September 21, 2018 8:24 am","Citizen states citizen states there are weeds coming up through the street, potholes citizen states need gravel repavement",,,,,
https://www.rva311.com/rvaone/Requests/ViewRequestDetail?requestId=DPW000008173&type=new_cs180221194656&viewRole=,DPW000008173,Assigned,"September 21, 2018 8:18 am",Communication called stating a tree had fallen and is blocking the street.,,,,,
https://www.rva311.com/rvaone/Requests/ViewRequestDetail?requestId=DPW000008172&type=new_cs180221194656&viewRole=,DPW000008172,Assigned,"September 21, 2018 8:11 am",Tree ID: 26983 - tree branch is blocking street light.,,,,,
https://www.rva311.com/rvaone/Requests/ViewRequestDetail?requestId=DPU000001841&type=new_cs180228212504&viewRole=,DPU000001841,Assigned,"September 21, 2018 8:09 am",Silt and debris clogging drain - cracked concrete.,,,,,
https://www.rva311.com/rvaone/Requests/ViewRequestDetail?requestId=DPW000008171&type=new_cs180221194423&viewRole=,DPW000008171,Assigned,"September 21, 2018 8:06 am","GRTC bus stop was moved and citizen asks that the ""No Parking"" sign be moved accordingly. Sign is two houses up from the intersection on Fendall.",,,,,
https://www.rva311.com/rvaone/Requests/ViewRequestDetail?requestId=DPW000008170&type=new_cs180221194656&viewRole=,DPW000008170,Assigned,"September 21, 2018 7:51 am",citizen states there are several limbs dangling on the out skirt of tree... Citizen states tree need to be assessed it appears to be dead,,,,,
https://www.rva311.com/rvaone/Requests/ViewRequestDetail?requestId=DPU000001840&type=new_cs180228212504&viewRole=,DPU000001840,Assigned,"September 21, 2018 7:50 am",Storm drain is covered with debris,,,,,
https://www.rva311.com/rvaone/Requests/ViewRequestDetail?requestId=DPU000001839&type=new_cs180228212504&viewRole=,DPU000001839,Assigned,"September 21, 2018 7:49 am",Storm drain is covered with debris.,,,,,
https://www.rva311.com/rvaone/Requests/ViewRequestDetail?requestId=DPU000001838&type=new_cs180228212504&viewRole=,DPU000001838,Assigned,"September 21, 2018 6:31 am",The storm drain is completely plugged and floods Laburnum Ave and Hawthorne Ave. it is the south west corner of the intersection.,,,,,
https://www.rva311.com/rvaone/Requests/ViewRequestDetail?requestId=DPW000008169&type=new_cs180301154109&viewRole=,DPW000008169,Completed,"September 21, 2018 2:09 am",Pothole when turning from southbound N Hamilton Ave onto westbound 3800 block Broad St. Pothole exists in Broad St traffic lane.,,,,,
https://www.rva311.com/rvaone/Requests/ViewRequestDetail?requestId=DPW000008168&type=new_cs180301154109&viewRole=,DPW000008168,Completed,"September 21, 2018 2:02 am",Large pothole in northbound lane of Lafayette St when entering from Monument Ave. There may be an additional pothole in Monument Ave traffic as well or median/turning lane.,,,,,
https://www.rva311.com/rvaone/Requests/ViewRequestDetail?requestId=DPW000008167&type=new_cs180221194656&viewRole=,DPW000008167,Assigned,"September 20, 2018 9:34 pm","Large oak tree dead at 4107 Kingcrest Parkway, 23221 please ask arborist to come and see it and schedule removal. Tree diseased. We are worried it will fall on our house. Thank you.",,,,,
https://www.rva311.com/rvaone/Requests/ViewRequestDetail?requestId=DPW000008166&type=new_cs180301154109&viewRole=,DPW000008166,Completed,"September 20, 2018 8:02 pm",Deep pothole,,,,,
https://www.rva311.com/rvaone/Requests/ViewRequestDetail?requestId=DPW000008165&type=new_cs180221192758&viewRole=,DPW000008165,Assigned,"September 20, 2018 7:37 pm","the trash can and recycling compactor in front of Tottering Teacup is always full. people are putting trash on top and flies are buzzing around. unfortunately it's locked so we are unable to assist, but for the past two weeks trash has been spilling out. any help would be greatly appreciated! I am a new business on that block and trying to figure out how to get this corrected. Thanks again!",,,,,
https://www.rva311.com/rvaone/Requests/ViewRequestDetail?requestId=DPW000008164&type=new_cs180221194251&viewRole=,DPW000008164,Completed,"September 20, 2018 5:30 pm","he pedestrian light is broken , when she pushed the button it stays red instead of turning white cary street and three chopt",,,,,
https://www.rva311.com/rvaone/Requests/ViewRequestDetail?requestId=DPW000008161&type=new_cs180221194656&viewRole=,DPW000008161,Assigned,"September 20, 2018 5:18 pm",tree and metal grate are missing cast iron grate that surrounded tree is missing and it's creating a major trip hazard metal grate and tree need to be replaced,,,,,
https://www.rva311.com/rvaone/Requests/ViewRequestDetail?requestId=DPU000001837&type=new_cs180226204420&viewRole=,DPU000001837,Completed,"September 20, 2018 5:14 pm",like post was knocked over and removed and never replaced exposed wires sticking out of concrete base. street light needs to be replaced major trip hazard.,,,,,
https://www.rva311.com/rvaone/Requests/ViewRequestDetail?requestId=DPW000008159&type=new_cs180221194656&viewRole=,DPW000008159,Assigned,"September 20, 2018 5:12 pm","Huge dead tree overhangs busy road. I reported this over a month ago, shortly after a crew cut down the tree next door which wasn't dead. There is no mistaking the dead tree.",,,,,
https://www.rva311.com/rvaone/Requests/ViewRequestDetail?requestId=DPW000008158&type=new_cs180301154109&viewRole=,DPW000008158,Completed,"September 20, 2018 5:12 pm",citizen stated that there are several potholes on getting off the I-64 w on laburnum exit going to wards chamberlayne avenue,,,,,
https://www.rva311.com/rvaone/Requests/ViewRequestDetail?requestId=DPW000008157&type=new_cs180221194032&viewRole=,DPW000008157,Assigned,"September 20, 2018 5:10 pm",two deep potholes approximately two and a half feet wide by 2 ft deep,,,,,
https://www.rva311.com/rvaone/Requests/ViewRequestDetail?requestId=DPU000001836&type=new_cs180228212904&viewRole=,DPU000001836,Assigned,"September 20, 2018 4:45 pm",the drains are clogged in the back of the building and is causing puddles of water to fill in the driveway between both business that are there,,,,,
https://www.rva311.com/rvaone/Requests/ViewRequestDetail?requestId=DPW000008153&type=new_cs180221194423&viewRole=,DPW000008153,Completed,"September 20, 2018 4:13 pm",Stop sign needs to be replaced. Been gone for two months. Result of car accident.,,,,,
https://www.rva311.com/rvaone/Requests/ViewRequestDetail?requestId=DPW000008152&type=new_cs180301154109&viewRole=,DPW000008152,Completed,"September 20, 2018 4:12 pm",there are alot of potholes at this location,,,,,
https://www.rva311.com/rvaone/Requests/ViewRequestDetail?requestId=DPW000008151&type=new_cs180221194656&viewRole=,DPW000008151,Assigned,"September 20, 2018 4:00 pm",citizen stated that she would need someone to come out and cut the tree limb for the tree between 311 n 28th street,,,,,
https://www.rva311.com/rvaone/Requests/ViewRequestDetail?requestId=DPU000001835&type=new_cs180228212904&viewRole=,DPU000001835,Assigned,"September 20, 2018 3:54 pm",the blacktop around the drain is crumbing away.,,,,,
https://www.rva311.com/rvaone/Requests/ViewRequestDetail?requestId=DPW000008150&type=new_cs180221194251&viewRole=,DPW000008150,Completed,"September 20, 2018 3:54 pm",Cross walk flashing lights are broken on both sides of Forest Hill.,,,,,
https://www.rva311.com/rvaone/Requests/ViewRequestDetail?requestId=DPW000008148&type=new_cs180221192758&viewRole=,DPW000008148,Assigned,"September 20, 2018 3:29 pm",Someone dropped at least 50 pairs of crutches in the alley,,,,,
https://www.rva311.com/rvaone/Requests/ViewRequestDetail?requestId=DPW000008147&type=new_cs180221194032&viewRole=,DPW000008147,Assigned,"September 20, 2018 3:29 pm",would like to have alley repaved. states that it looks like it was asphalt at one point so now its just gravel. there are so many huge potholes up and down the alley.,,,,,
https://www.rva311.com/rvaone/Requests/ViewRequestDetail?requestId=DPW000008146&type=new_cs180301154109&viewRole=,DPW000008146,Completed,"September 20, 2018 3:26 pm",There is a pothole on Chippenham Parkway at the Forest Hill exit ramp in the left hand lane as you are heading towards Stony Point Fashion Park.,,,,,
https://www.rva311.com/rvaone/Requests/ViewRequestDetail?requestId=DPW000008145&type=new_cs180221192758&viewRole=,DPW000008145,Completed,"September 20, 2018 3:25 pm","have some missed trash that has not been picked up in the last two weeks , plié wood a bunch of lumber and something that looks like it to- three sizes bigger than a toilet tank",,,,,
https://www.rva311.com/rvaone/Requests/ViewRequestDetail?requestId=DPW000008144&type=new_cs180301154109&viewRole=,DPW000008144,Completed,"September 20, 2018 3:15 pm",located in front of residence about 12 inches deep size of basketball,,,,,
https://www.rva311.com/rvaone/Requests/ViewRequestDetail?requestId=DPW000008142&type=new_cs180221194656&viewRole=,DPW000008142,Assigned,"September 20, 2018 3:10 pm","As a result of 1) a recent car accident, and 2) the recent storm, large branches and limbs have fallen across the south sidewalk on Lakeview Ave between S Rowland St and Shields Ave. Pedestrians must move into the busy street.",,,,,
https://www.rva311.com/rvaone/Requests/ViewRequestDetail?requestId=DPW000008140&type=new_cs180301154109&viewRole=,DPW000008140,Completed,"September 20, 2018 2:59 pm",there large pothole in the middle of street,,,,,
https://www.rva311.com/rvaone/Requests/ViewRequestDetail?requestId=DPU000001834&type=new_cs180226204420&viewRole=,DPU000001834,Completed,"September 20, 2018 2:58 pm",Caller states the light in the alley behind his residence is out.,,,,,
https://www.rva311.com/rvaone/Requests/ViewRequestDetail?requestId=DPW000008138&type=new_cs180301154109&viewRole=,DPW000008138,Assigned,"September 20, 2018 2:37 pm",Road between 24th and 25th on East Franklin has numerous potholes. The situation is getting worse and worse because of the recent influx of buses.,,,,,
https://www.rva311.com/rvaone/Requests/ViewRequestDetail?requestId=DPW000008137&type=new_cs180301154109&viewRole=,DPW000008137,Assigned,"September 20, 2018 2:35 pm",this hole is exposing metal under the cement in the street and it located on the corner or Clearfield and Kendall,,,,,
https://www.rva311.com/rvaone/Requests/ViewRequestDetail?requestId=DPU000001833&type=new_cs180228212904&viewRole=,DPU000001833,Assigned,"September 20, 2018 2:35 pm",everytime it rains the street gets backed up,,,,,
https://www.rva311.com/rvaone/Requests/ViewRequestDetail?requestId=DPW000008136&type=new_cs180301154109&viewRole=,DPW000008136,Completed,"September 20, 2018 2:32 pm",Large pothole near curb in the eastbound lanes of Patterson Avenue at Willow Lawn Drive located directly in front of GRTC bus stop # 2066.,,,,,
https://www.rva311.com/rvaone/Requests/ViewRequestDetail?requestId=DPW000008134&type=new_cs180221194656&viewRole=,DPW000008134,Assigned,"September 20, 2018 2:27 pm",Caller states there is a tree in the easement between the two properties that is leaning toward the house - it is not listed as a city tree but the citizen wants COR to check to see if it is city responsibility.,,,,,
https://www.rva311.com/rvaone/Requests/ViewRequestDetail?requestId=DPW000008133&type=new_cs180221194656&viewRole=,DPW000008133,Assigned,"September 20, 2018 2:22 pm","Large dead limb hanging over the yard at 4203 Monument, concerned that it should fall and injure persons including children",,,,,
https://www.rva311.com/rvaone/Requests/ViewRequestDetail?requestId=DPW000008132&type=new_cs180221194656&viewRole=,DPW000008132,Assigned,"September 20, 2018 2:18 pm",Large Dead tree limb hanging over River Road along the Country Club of Virginia side near the intersection of Huntley Road and River Road,,,,,
https://www.rva311.com/rvaone/Requests/ViewRequestDetail?requestId=DPW000008131&type=new_cs180221194656&viewRole=,DPW000008131,Assigned,"September 20, 2018 2:17 pm","have a tree in the yard and would like to know if it can be assessed and it showing some dead tree limbs , last year was trimmed but thinks it was trimmed a bit much because not it looks as if it could be dead and she asked if she can be present while some comes out and trimmed the tree , may the code enforcer call the Citizen",,,,,
https://www.rva311.com/rvaone/Requests/ViewRequestDetail?requestId=DPW000008130&type=new_cs180221194423&viewRole=,DPW000008130,Assigned,"September 20, 2018 2:17 pm","GRTC Stop #2215 does not have blades for all routes that serve it, only for 18 and 19",,,,,
https://www.rva311.com/rvaone/Requests/ViewRequestDetail?requestId=DPW000008129&type=new_cs180221194032&viewRole=,DPW000008129,Assigned,"September 20, 2018 2:15 pm",Alley badly damaged at this location full of potholes need repair asap. Alley between Hancock and Harrison parcel with Marshall St.,,,,,
https://www.rva311.com/rvaone/Requests/ViewRequestDetail?requestId=DPW000008128&type=new_cs180221192758&viewRole=,DPW000008128,Completed,"September 20, 2018 2:10 pm","Caller states between the business and the apartment upstairs, there are four cans out for collection that have not been picked up.",,,,,
https://www.rva311.com/rvaone/Requests/ViewRequestDetail?requestId=DPW000008125&type=new_cs180301154109&viewRole=,DPW000008125,Completed,"September 20, 2018 2:03 pm",there is a pothole right in front of her address,,,,,
https://www.rva311.com/rvaone/Requests/ViewRequestDetail?requestId=DPW000008124&type=new_cs180221194423&viewRole=,DPW000008124,Completed,"September 20, 2018 2:01 pm","Travelling on 9th street, south bound at intersection with Byrd street, the sign between the two traffic lights is missing. The sign indicated that the right lane was straight travel and left lane was left turn only (onto expressway or E Byrd) is missing. Cars that should be turning left will attempt to go straight and merge in the intersection.",,,,,
https://www.rva311.com/rvaone/Requests/ViewRequestDetail?requestId=DPW000008122&type=new_cs180221194032&viewRole=,DPW000008122,Assigned,"September 20, 2018 1:36 pm","In the alley that runs behind the businesses on the 2900 block of West Cary (capital one, bevs, citizen burger) the alley way has several craters, pot holes, standing water and the road is really a mess. Paving the alley would be really beneficial to the business and the residents who utilize the alley for deliveries, to get to their homes, etc.",,,,,
https://www.rva311.com/rvaone/Requests/ViewRequestDetail?requestId=DPW000008121&type=new_cs180221194656&viewRole=,DPW000008121,Assigned,"September 20, 2018 1:34 pm",There is a dead tree on the City easement on the NW corner of Three Chopt and Grove,,,,,
https://www.rva311.com/rvaone/Requests/ViewRequestDetail?requestId=DPU000001831&type=new_cs180228212504&viewRole=,DPU000001831,Assigned,"September 20, 2018 1:34 pm",There are 2 drainage pipes in front of my house. One funnels water from my neighbors underneath the driveway. The other drains across Waxford carrying water downhill towards the James. The ditch and both drains are clogged with debris.,,,,,
https://www.rva311.com/rvaone/Requests/ViewRequestDetail?requestId=DPU000001830&type=new_cs180226204420&viewRole=,DPU000001830,Completed,"September 20, 2018 1:33 pm",Pole and light are down and on the ground.,,,,,
https://www.rva311.com/rvaone/Requests/ViewRequestDetail?requestId=DPW000008120&type=new_cs180221194656&viewRole=,DPW000008120,Assigned,"September 20, 2018 1:33 pm",Dead tree need to be cut down at address,,,,,
https://www.rva311.com/rvaone/Requests/ViewRequestDetail?requestId=DPW000008119&type=new_cs180221194656&viewRole=,DPW000008119,Assigned,"September 20, 2018 1:28 pm",Citizen states there is a city tree in front of her home between the sidewalk and the street; it has a white fungus on it and is dropping limbs; the barks is separating form the tree; requests to have tree assessed,,,,,
https://www.rva311.com/rvaone/Requests/ViewRequestDetail?requestId=DPW000008118&type=new_cs180221194656&viewRole=,DPW000008118,Assigned,"September 20, 2018 1:24 pm","we've had a request in since March 5th. The ticket number is #108479. They've come out and marked one tree (they marked the tree in question about four or five months ago, but no cutting has occurred). We also requested they prune another oak a bit so that limbs do not blow against our roof. We are at 4215 Monument Ave, on the se corner of Sauer and Monument. The tree marked for removal is on Sauer close to Wythe. Thanks for checking on this. Bill Bill Yates wyatesva@gmail.com 804-677-3957",,,,,
https://www.rva311.com/rvaone/Requests/ViewRequestDetail?requestId=DPW000008117&type=new_cs180221192758&viewRole=,DPW000008117,Assigned,"September 20, 2018 1:15 pm",We moved debris from road and sawed it up. It is still on the curb,,,,,
https://www.rva311.com/rvaone/Requests/ViewRequestDetail?requestId=DPW000008116&type=new_cs180221194656&viewRole=,DPW000008116,Assigned,"September 20, 2018 1:01 pm",WOULD LIKE TO HAVE TREESEXAMINED. CITIZEN THINKS THAT THEY MAYBE ROOTING AND WOULD LIKE TO HAVE THEM SAVED BEFORE THEY ARE JUST CUT DOWN. THE TREES ARE ON THE SIDE STREET ON DAVIS,,,,,
https://www.rva311.com/rvaone/Requests/ViewRequestDetail?requestId=RPD000000294&type=new_cs180327173306&viewRole=,RPD000000294,Completed,"September 20, 2018 12:46 pm",Citizen states that someone dumped 4 or more large bags of garbage on the corner; needs pick up; please investigate,,,,,
https://www.rva311.com/rvaone/Requests/ViewRequestDetail?requestId=DPW000008115&type=new_cs180221192758&viewRole=,DPW000008115,Assigned,"September 20, 2018 12:41 pm","Several large branches fell from the city maintained trees along both Gun Club and Queen Charlotte. I cut them up and moved them to the median/gutter, but it's a lot of debris and some is blocking sidewalks.",,,,,
https://www.rva311.com/rvaone/Requests/ViewRequestDetail?requestId=DPU000001828&type=new_cs180228212504&viewRole=,DPU000001828,Assigned,"September 20, 2018 12:40 pm",citizen states with recent storms back up leaves and debris is clogging up drain causing standing water when it rains citizen states he live at the bottom of a hill,,,,,
https://www.rva311.com/rvaone/Requests/ViewRequestDetail?requestId=DPU000001827&type=new_cs180301150531&viewRole=,DPU000001827,Assigned,"September 20, 2018 12:36 pm",Missing round cover in HIGH pedestrian school zone. Kids are in endangered. Located along Jahnke at the entrance of the bus loop on the sidewalk near a crosswalk.,,,,,
https://www.rva311.com/rvaone/Requests/ViewRequestDetail?requestId=DPW000008113&type=new_cs180301154109&viewRole=,DPW000008113,Completed,"September 20, 2018 12:32 pm",there are 2 potholes in front of this location,,,,,
https://www.rva311.com/rvaone/Requests/ViewRequestDetail?requestId=DPW000008112&type=new_cs180221194656&viewRole=,DPW000008112,Assigned,"September 20, 2018 12:28 pm",Citizen stated that he put in a request for tree trimming (DPW000002848 ) but no one has cam out there to complete it but due to a 24 day overdue this is a new request where he would like to have some one to contact him in regard to trimming the tree,,,,,
https://www.rva311.com/rvaone/Requests/ViewRequestDetail?requestId=DPW000008110&type=new_cs180221194032&viewRole=,DPW000008110,Assigned,"September 20, 2018 12:20 pm",Streets need to be paved and cleaned,,,,,
https://www.rva311.com/rvaone/Requests/ViewRequestDetail?requestId=DPW000008109&type=new_cs180301154109&viewRole=,DPW000008109,Assigned,"September 20, 2018 12:18 pm","Bike lane markings have faded and are blending into the pavement, especially when it rains. Cars are also driving in the bike lane headed westbound near the 12th st.",,,,,
https://www.rva311.com/rvaone/Requests/ViewRequestDetail?requestId=DPU000001826&type=new_cs180228212504&viewRole=,DPU000001826,Assigned,"September 20, 2018 12:12 pm",Corner of 100 Bland Street and Crutchfield on the side the residence located at 3700 Crutchfield Street,,,,,
https://www.rva311.com/rvaone/Requests/ViewRequestDetail?requestId=DPU000001825&type=new_cs180228212504&viewRole=,DPU000001825,Assigned,"September 20, 2018 12:10 pm",Storm drain completely blocked at the corner of 15 Dundee Avenue and Moody Avenue - in front of the house number 15,,,,,
https://www.rva311.com/rvaone/Requests/ViewRequestDetail?requestId=DPW000008105&type=new_cs180301154109&viewRole=,DPW000008105,Completed,"September 20, 2018 12:07 pm",Large deep pothole located in the right lane at the corner of West Roanoke Street and Midlothian Turnpike near the 3700 block of Midlothian Turnpike by Swansboro church,,,,,
https://www.rva311.com/rvaone/Requests/ViewRequestDetail?requestId=DPW000008104&type=new_cs180301154109&viewRole=,DPW000008104,Completed,"September 20, 2018 11:55 am",Caller states there are pot holes along Price St.,,,,,
https://www.rva311.com/rvaone/Requests/ViewRequestDetail?requestId=DPW000008103&type=new_cs180221194457&viewRole=,DPW000008103,Assigned,"September 20, 2018 11:54 am",Lot between 5410 and 5420 Campbell St,,,,,
https://www.rva311.com/rvaone/Requests/ViewRequestDetail?requestId=DPW000008102&type=new_cs180221192758&viewRole=,DPW000008102,Completed,"September 20, 2018 11:47 am",Caller states his trash was not picked up - home backs up to alley but no alley access so collection is on side.,,,,,
https://www.rva311.com/rvaone/Requests/ViewRequestDetail?requestId=DPW000008101&type=new_cs180221192758&viewRole=,DPW000008101,Completed,"September 20, 2018 11:42 am",Road may have been blocked with emergency repair crews. 8138 also affected.,,,,,
https://www.rva311.com/rvaone/Requests/ViewRequestDetail?requestId=DPW000008100&type=new_cs180221192758&viewRole=,DPW000008100,Completed,"September 20, 2018 11:38 am","trash trucks came but did not come in this area of blend well rd. and walmsley blvd , citizen stated that the trucks pick up al around them",,,,,
https://www.rva311.com/rvaone/Requests/ViewRequestDetail?requestId=DPW000008099&type=new_cs180221194656&viewRole=,DPW000008099,Assigned,"September 20, 2018 11:38 am","Tree fell over fence from city property onto parking lot, another tree down from that tree is ready to fall",,,,,
https://www.rva311.com/rvaone/Requests/ViewRequestDetail?requestId=DPW000008098&type=new_cs180221192758&viewRole=,DPW000008098,Assigned,"September 20, 2018 11:38 am",The large pile of dead tree branches and sofas needs to be removed from the corner of 21st and Carrington Street,,,,,
https://www.rva311.com/rvaone/Requests/ViewRequestDetail?requestId=DPU000001824&type=new_cs180226204420&viewRole=,DPU000001824,Completed,"September 20, 2018 11:37 am",light out,,,,,
https://www.rva311.com/rvaone/Requests/ViewRequestDetail?requestId=DPW000008097&type=new_cs180221194457&viewRole=,DPW000008097,Assigned,"September 20, 2018 11:33 am",vegetation blocking drain causing road to flood bc of improper drainage,,,,,
https://www.rva311.com/rvaone/Requests/ViewRequestDetail?requestId=DPW000008096&type=new_cs180221194656&viewRole=,DPW000008096,Assigned,"September 20, 2018 11:32 am",trees limbs fell on the utility lines in the ally,,,,,
