Service Request URL,Service Request,Status,Request Date,Description,,,,,
https://www.rva311.com/rvaone/Requests/ViewRequestDetail?requestId=DPW000008862&type=new_cs180221194032&viewRole=,DPW000008862,Assigned,"September 30, 2018 11:41 pm",The entrance continues to erode on Gladstone behind 3201 garland and 3200 North Avenue. Rocks spill into the street causing street damage and blocking the flow of water. Please repair to add cement entrance similar to the one opposite.,,,,,
https://www.rva311.com/rvaone/Requests/ViewRequestDetail?requestId=PDR000001506&type=new_cs180301161330&viewRole=,PDR000001506,Completed,"September 30, 2018 9:47 pm","Motorcycle has been sitting here for a long time, obviously, with expired tags. Never seems to receive parking tickets on street cleaning days.",,,,,
https://www.rva311.com/rvaone/Requests/ViewRequestDetail?requestId=DPW000008861&type=new_cs180221192758&viewRole=,DPW000008861,Assigned,"September 30, 2018 9:42 pm",Someone left a mattress and other large item for trash on sidewalk East side of 700 block of north boulevard closest to monument ave,,,,,
https://www.rva311.com/rvaone/Requests/ViewRequestDetail?requestId=DPW000008860&type=new_cs180221192758&viewRole=,DPW000008860,Assigned,"September 30, 2018 9:39 pm",Someone left multiple furniture/ large items for trash on the sidewalk East side of 800 block of north boulevard between grace and broad st,,,,,
https://www.rva311.com/rvaone/Requests/ViewRequestDetail?requestId=DPW000008859&type=new_cs180221192758&viewRole=,DPW000008859,Assigned,"September 30, 2018 9:35 pm","Tan colored couch on the sidewalk of the north side of the 2700 block of w grace st, someone left for trash",,,,,
https://www.rva311.com/rvaone/Requests/ViewRequestDetail?requestId=DPU000001977&type=new_cs180226204420&viewRole=,DPU000001977,Completed,"September 30, 2018 8:18 pm",Light out in front of 4211 Brook Rd. Pole number DF 39,,,,,
https://www.rva311.com/rvaone/Requests/ViewRequestDetail?requestId=DPU000001976&type=new_cs180226204420&viewRole=,DPU000001976,Completed,"September 30, 2018 8:16 pm",Light is barely glowing. One house passed Bellevue going north on Brook. Pole number DF 38,,,,,
https://www.rva311.com/rvaone/Requests/ViewRequestDetail?requestId=DPU000001975&type=new_cs180226204420&viewRole=,DPU000001975,Completed,"September 30, 2018 8:14 pm",Light blinking often on in front of 4204 Brook Rd. Pole number DF 18,,,,,
https://www.rva311.com/rvaone/Requests/ViewRequestDetail?requestId=DPU000001974&type=new_cs180226204420&viewRole=,DPU000001974,Completed,"September 30, 2018 8:11 pm",Light out at Brooke and Stanhope. Light on southwest corner Pole number CG,,,,,
https://www.rva311.com/rvaone/Requests/ViewRequestDetail?requestId=DPU000001973&type=new_cs180226204420&viewRole=,DPU000001973,Completed,"September 30, 2018 8:05 pm",Light out going south on Brook Road pole number EO 10,,,,,
https://www.rva311.com/rvaone/Requests/ViewRequestDetail?requestId=RPD000000318&type=new_cs180529151322&viewRole=,RPD000000318,Completed,"September 30, 2018 6:19 pm",2 Ford mustangs abandoned for over a month in front of my house. License plates 93252(hp) silver mustang and license plate 98323(hp) gray mustang,,,,,
https://www.rva311.com/rvaone/Requests/ViewRequestDetail?requestId=RPD000000317&type=new_cs180529151322&viewRole=,RPD000000317,Completed,"September 30, 2018 4:49 pm",Cream color Nissan Frontier pick up truck has been parked on colonial for at least 6 weeks. No evident owner in the neighborhood.,,,,,
https://www.rva311.com/rvaone/Requests/ViewRequestDetail?requestId=DPW000008858&type=new_cs180221194457&viewRole=,DPW000008858,Assigned,"September 30, 2018 3:47 pm",The grass at Lombardy Park needs to be mowed and edged. I am the City Park Steward. Please have the grass mowed.,,,,,
https://www.rva311.com/rvaone/Requests/ViewRequestDetail?requestId=DPW000008857&type=new_cs180221194032&viewRole=,DPW000008857,Assigned,"September 30, 2018 2:25 pm",8 by 10 foot sunken entrance to alley between S Boulevard and S Mulberry off of W Main St. Fills with water every time it rains. Water meter is located in middle of sunken area. Hazard to pedestrians and cars.,,,,,
https://www.rva311.com/rvaone/Requests/ViewRequestDetail?requestId=DPW000008856&type=new_cs180301154109&viewRole=,DPW000008856,Completed,"September 30, 2018 2:20 pm",It was a deep pothole adjacent a storm cover near the corner of N Pine St and W Broad St near the new VCU building. It damaged my car additional angle Additional photo,,,,,
https://www.rva311.com/rvaone/Requests/ViewRequestDetail?requestId=DPU000001972&type=new_cs180226204420&viewRole=,DPU000001972,Completed,"September 30, 2018 1:11 pm","totally dark, not safe",,,,,
https://www.rva311.com/rvaone/Requests/ViewRequestDetail?requestId=DPU000001971&type=new_cs180226204420&viewRole=,DPU000001971,Completed,"September 30, 2018 12:53 pm",Has not worked for months,,,,,
https://www.rva311.com/rvaone/Requests/ViewRequestDetail?requestId=DPW000008853&type=new_cs180301154109&viewRole=,DPW000008853,Completed,"September 30, 2018 10:57 am",3 potholes in the intersection of north ave and hazlehurst,,,,,
https://www.rva311.com/rvaone/Requests/ViewRequestDetail?requestId=DPU000001970&type=new_cs180226204420&viewRole=,DPU000001970,Completed,"September 30, 2018 2:31 am","Light out in the middle of the 300 block of E 3rd St, next to the address on Stockton St.",,,,,
https://www.rva311.com/rvaone/Requests/ViewRequestDetail?requestId=DPU000001969&type=new_cs180226204420&viewRole=,DPU000001969,Completed,"September 30, 2018 2:27 am",There are three lights out on the Manchester Bridge southbound.,,,,,
https://www.rva311.com/rvaone/Requests/ViewRequestDetail?requestId=DPW000008852&type=new_cs180221194423&viewRole=,DPW000008852,Assigned,"September 30, 2018 2:24 am","There is a sign facing eastbound traffic on Main St for ""east-west US 60"". This sign can simply be moved to face southbound traffic on 14th St, because Main St is US 60 at this intersection. I reported this in 2015, and it was never moved. Making this even more ridiculous, the sign incorrectly tells people to turn left on US 60, and there is a ""no left turn"" sign here.",,,,,
https://www.rva311.com/rvaone/Requests/ViewRequestDetail?requestId=DPU000001968&type=new_cs180226204420&viewRole=,DPU000001968,Completed,"September 30, 2018 2:19 am",Light in the the middle of the 1400 block of E Franklin St is out.,,,,,
https://www.rva311.com/rvaone/Requests/ViewRequestDetail?requestId=DPU000001967&type=new_cs180226204420&viewRole=,DPU000001967,Completed,"September 30, 2018 2:17 am",Light in the middle of the 1200 block of E Main St is flickering.,,,,,
https://www.rva311.com/rvaone/Requests/ViewRequestDetail?requestId=RPD000000316&type=new_cs180529151322&viewRole=,RPD000000316,Completed,"September 29, 2018 8:08 pm",Black Jeep abandoned on city street. Talked to neighbors; no one knows anything about it.,,,,,
https://www.rva311.com/rvaone/Requests/ViewRequestDetail?requestId=DPW000008850&type=new_cs180221190731&viewRole=,DPW000008850,Completed,"September 29, 2018 8:02 pm",Traffic heading east on Mcrand; multiple drivers daily make illegal right turn from Mcrand onto E 37th Street. Potential hazard.,,,,,
https://www.rva311.com/rvaone/Requests/ViewRequestDetail?requestId=DPU000001966&type=new_cs180228155543&viewRole=,DPU000001966,Assigned,"September 29, 2018 6:36 pm","This sinkhole is located at the base of the light pole between 4210 and 4208 Cutshaw avenue. It is increasing in size. It is now several feet deep, over a foot wide, and traveling under the city sidewalk. It poses a significant risk to people and pets.",,,,,
https://www.rva311.com/rvaone/Requests/ViewRequestDetail?requestId=DPW000008849&type=new_cs180221194032&viewRole=,DPW000008849,Assigned,"September 29, 2018 6:22 pm","This alley has no gravel remaining. It was improperly graded last year. Now, during any significant rainfall, water pools in the alley. This can cause the pooled water to then flood my yard. Also, this creates a health hazard as the water can take up to a week to drain causing a breeding ground for mosquitoes. The alley needs to be properly graded and graveled.",,,,,
https://www.rva311.com/rvaone/Requests/ViewRequestDetail?requestId=RPD000000315&type=new_cs180529151322&viewRole=,RPD000000315,Completed,"September 29, 2018 2:08 pm","A Saab with Virginia plate WZE-2048 has been sitting in a public parking spot on 21st Street near the intersection with east Grace Street for too long. It has front-end damage, has a piece of cardboard sticking out from under the front hood, has a temporary tire on the rear, and an expired state inspection sticker.",,,,,
https://www.rva311.com/rvaone/Requests/ViewRequestDetail?requestId=RPD000000314&type=new_cs180529151350&viewRole=,RPD000000314,Completed,"September 29, 2018 1:17 pm",car has been continuously parked in front of fire hydrant for several days.,,,,,
https://www.rva311.com/rvaone/Requests/ViewRequestDetail?requestId=DPW000008847&type=new_cs180221192758&viewRole=,DPW000008847,Assigned,"September 29, 2018 12:54 pm",Storm Debris and branches. Pile of cut branches stacked in alley behind 4717 Augusta Ave.,,,,,
https://www.rva311.com/rvaone/Requests/ViewRequestDetail?requestId=DPU000001962&type=new_cs180301150531&viewRole=,DPU000001962,Assigned,"September 29, 2018 10:07 am",The fire hydrant is leaking,,,,,
https://www.rva311.com/rvaone/Requests/ViewRequestDetail?requestId=RPD000000313&type=new_cs180529151322&viewRole=,RPD000000313,Completed,"September 29, 2018 9:53 am",2 Ford mustangs abandoned for over a month in front of my house. License plates 93252(hp) silver mustang and license plate 98323(hp) gray mustang,,,,,
https://www.rva311.com/rvaone/Requests/ViewRequestDetail?requestId=DPW000008843&type=new_cs180221194423&viewRole=,DPW000008843,Assigned,"September 29, 2018 9:43 am",One way sign sign knocked over in the round about,,,,,
https://www.rva311.com/rvaone/Requests/ViewRequestDetail?requestId=DPW000008842&type=new_cs180221194457&viewRole=,DPW000008842,Assigned,"September 29, 2018 9:28 am",Bushes on east side of Oregon hill roundhouse overgrown. Creating safety issue. Please cut back.,,,,,
https://www.rva311.com/rvaone/Requests/ViewRequestDetail?requestId=DPW000008841&type=new_cs180301154109&viewRole=,DPW000008841,Completed,"September 29, 2018 7:59 am",Multiple potholes at Evelyn Byrd and Prince arthur,,,,,
https://www.rva311.com/rvaone/Requests/ViewRequestDetail?requestId=DPU000001961&type=new_cs180226204420&viewRole=,DPU000001961,Completed,"September 29, 2018 1:24 am",Bulbs are out on both northbound and southbound sides of the Nickel Bridge from Byrd Park.,,,,,
https://www.rva311.com/rvaone/Requests/ViewRequestDetail?requestId=DPW000008840&type=new_cs180221194251&viewRole=,DPW000008840,Completed,"September 29, 2018 1:18 am",Heading northbound. one of the flashing yellow bulbs on the sign that warns that the lane ends is out before driving across the Nickel Bridge from southside.,,,,,
https://www.rva311.com/rvaone/Requests/ViewRequestDetail?requestId=DPW000008839&type=new_cs180301154109&viewRole=,DPW000008839,Completed,"September 29, 2018 1:08 am",Pothole in the street in front of 2814 Fendall Ave.,,,,,
https://www.rva311.com/rvaone/Requests/ViewRequestDetail?requestId=DPW000008838&type=new_cs180301154109&viewRole=,DPW000008838,Completed,"September 29, 2018 12:05 am",pot hole repair,,,,,
https://www.rva311.com/rvaone/Requests/ViewRequestDetail?requestId=DPU000001960&type=new_cs180226204420&viewRole=,DPU000001960,Completed,"September 28, 2018 11:01 pm","Thank you for all you do. Street light on this block of N Lombardy St on the odd side, number 15",,,,,
https://www.rva311.com/rvaone/Requests/ViewRequestDetail?requestId=RPD000000312&type=new_cs180327174102&viewRole=,RPD000000312,Assigned,"September 28, 2018 10:20 pm","Why is the speed limit not enforced on Idlewood Ave? Speed Bumps, Speed Bumps, Speed Bumps... I see these all over town. Other schools have speed bumps in place to calm traffic around them. Is it a possibility to get these in place here along Idlewood? I live across the street from St Andrews Elementary School in a 25 mph, school/residential zone. After numerous complaints I continue to see vehicles speeding down Idlewood Avenue on a daily basis.",,,,,
https://www.rva311.com/rvaone/Requests/ViewRequestDetail?requestId=DPW000008837&type=new_cs180301154109&viewRole=,DPW000008837,Assigned,"September 28, 2018 9:07 pm",SECOND REQUEST. There is a manhole that sits very high in this section of Jahnke Rd. heading towards Chippenham Hospital. It causes vehicle damage and traffic slowdowns. Please lower this manhole or pave around it. Please do not close this case without explanation. Thank you!,,,,,
https://www.rva311.com/rvaone/Requests/ViewRequestDetail?requestId=DPU000001959&type=new_cs180221191708&viewRole=,DPU000001959,In Progress,"September 28, 2018 8:13 pm",This part of the 1000 block of 47th street is extremely dark at night. There is a utility pole directly across the street from 1002 West 47th Street (east side of 47th Street) that a streetlight could be placed on.,,,,,
https://www.rva311.com/rvaone/Requests/ViewRequestDetail?requestId=DPW000008836&type=new_cs180301154109&viewRole=,DPW000008836,Completed,"September 28, 2018 5:55 pm",Pothole at intersection of Blacker and Augusta.,,,,,
https://www.rva311.com/rvaone/Requests/ViewRequestDetail?requestId=DPU000001958&type=new_cs180226204420&viewRole=,DPU000001958,In Progress,"September 28, 2018 5:18 pm",4 Linear park path street lights are out along red brick wall fronting Belvedere. Some are obstructed by trees.,,,,,
https://www.rva311.com/rvaone/Requests/ViewRequestDetail?requestId=DPW000008834&type=new_cs180221194656&viewRole=,DPW000008834,Assigned,"September 28, 2018 5:12 pm",Would like to have the tree removed. It look as if it is slowly dying and citizen does not want it to fall.,,,,,
https://www.rva311.com/rvaone/Requests/ViewRequestDetail?requestId=DPW000008829&type=new_cs180301154109&viewRole=,DPW000008829,Completed,"September 28, 2018 4:33 pm",on w 33rd and midlothian turnpike and Dundee avenue on the same side of the street it righ on the corn on the side of her home,,,,,
https://www.rva311.com/rvaone/Requests/ViewRequestDetail?requestId=DPW000008825&type=new_cs180221192758&viewRole=,DPW000008825,Assigned,"September 28, 2018 4:14 pm",set the storm debris on the curb and would like to pick them up,,,,,
https://www.rva311.com/rvaone/Requests/ViewRequestDetail?requestId=DPW000008822&type=new_cs180221194423&viewRole=,DPW000008822,Assigned,"September 28, 2018 4:08 pm",sign was knocked over is currently laying in the grass,,,,,
https://www.rva311.com/rvaone/Requests/ViewRequestDetail?requestId=DPW000008821&type=new_cs180301154109&viewRole=,DPW000008821,Assigned,"September 28, 2018 4:07 pm",Water does not drain. Constant standing water along curb.,,,,,
https://www.rva311.com/rvaone/Requests/ViewRequestDetail?requestId=DPU000001957&type=new_cs180228212504&viewRole=,DPU000001957,Assigned,"September 28, 2018 4:05 pm",Rainwater collects and does not at base of handicapped ramp on sidewalk in front of Hill Cafe. Makes it difficult to access sidewalk during and after rainfall. It is a access issue as well as a public health issue (standing water leading to mosquito breeding),,,,,
https://www.rva311.com/rvaone/Requests/ViewRequestDetail?requestId=DPW000008820&type=new_cs180221194656&viewRole=,DPW000008820,Assigned,"September 28, 2018 4:00 pm",Tree in city’s right of way in front of residence is causing sidewalk and street damage. Major trip hazard for pedestrians.,,,,,
https://www.rva311.com/rvaone/Requests/ViewRequestDetail?requestId=DPU000001956&type=new_cs180226204420&viewRole=,DPU000001956,Completed,"September 28, 2018 3:55 pm","Street light seems to over heat after a period of being on, goes out for awhile, eventually comes back on, and then repeats the process.",,,,,
https://www.rva311.com/rvaone/Requests/ViewRequestDetail?requestId=DPU000001955&type=new_cs180226204420&viewRole=,DPU000001955,Completed,"September 28, 2018 3:44 pm",Four street lights in a row are out on Rugby Road starting at the intersection of Carillion Ct and going south.,,,,,
https://www.rva311.com/rvaone/Requests/ViewRequestDetail?requestId=PDR000001492&type=new_cs180301161330&viewRole=,PDR000001492,Completed,"September 28, 2018 3:44 pm",Honda Accord license VAUZX-4153. Parked in front of our house over a week. Does not belong to any of our neighbors.,,,,,
https://www.rva311.com/rvaone/Requests/ViewRequestDetail?requestId=DPW000008815&type=new_cs180221194251&viewRole=,DPW000008815,Completed,"September 28, 2018 3:22 pm",traffic light at three chopt and cary st is completely out,,,,,
https://www.rva311.com/rvaone/Requests/ViewRequestDetail?requestId=DPW000008813&type=new_cs180221192758&viewRole=,DPW000008813,Assigned,"September 28, 2018 3:05 pm","Piled up at rear, next to alley",,,,,
https://www.rva311.com/rvaone/Requests/ViewRequestDetail?requestId=DPU000001954&type=new_cs180228204004&viewRole=,DPU000001954,Assigned,"September 28, 2018 2:58 pm",missing manhole and storm drain in clogged with debris . Man hole is located across the street from the corner of Decatur and Evans st,,,,,
https://www.rva311.com/rvaone/Requests/ViewRequestDetail?requestId=RPD000000311&type=new_cs180529151322&viewRole=,RPD000000311,Completed,"September 28, 2018 2:50 pm",location is branch and Patrick car with no tags and wheels are bald its a trailor,,,,,
https://www.rva311.com/rvaone/Requests/ViewRequestDetail?requestId=DPW000008809&type=new_cs180221194423&viewRole=,DPW000008809,Completed,"September 28, 2018 2:33 pm",stop sign missing. and its very important that its replaced because some took the permanent on,,,,,
https://www.rva311.com/rvaone/Requests/ViewRequestDetail?requestId=DPU000001953&type=new_cs180226204420&viewRole=,DPU000001953,Completed,"September 28, 2018 2:13 pm",1 dim light at 104 W. Lancaster; 1 light covered with trees @ 108 W. Lancaster,,,,,
https://www.rva311.com/rvaone/Requests/ViewRequestDetail?requestId=DPW000008802&type=new_cs180221190731&viewRole=,DPW000008802,Completed,"September 28, 2018 1:50 pm",business owner looking to have signs installed for a set amount of time parking only please contact to advise,,,,,
https://www.rva311.com/rvaone/Requests/ViewRequestDetail?requestId=DPW000008800&type=new_cs180221192758&viewRole=,DPW000008800,Assigned,"September 28, 2018 1:46 pm",Trash pickup missed on scheduled day,,,,,
https://www.rva311.com/rvaone/Requests/ViewRequestDetail?requestId=DPW000008798&type=new_cs180301154109&viewRole=,DPW000008798,Completed,"September 28, 2018 1:37 pm",There are some big pot hole at this location please repairs asap.,,,,,
https://www.rva311.com/rvaone/Requests/ViewRequestDetail?requestId=DPW000008796&type=new_cs180221194656&viewRole=,DPW000008796,Assigned,"September 28, 2018 1:21 pm","tree is at edge of the street that has a limb that hangs over to her front porch , would like to have removed before the winter arrives and the tree limb falls into her front door",,,,,
https://www.rva311.com/rvaone/Requests/ViewRequestDetail?requestId=DPW000008795&type=new_cs180221190731&viewRole=,DPW000008795,Assigned,"September 28, 2018 1:19 pm",there was a sign there but now its not and would like it replaced.,,,,,
https://www.rva311.com/rvaone/Requests/ViewRequestDetail?requestId=DPW000008790&type=new_cs180221194656&viewRole=,DPW000008790,Assigned,"September 28, 2018 12:47 pm",City tree needs to be removed pushing up side walk. Unable to use sidewalk there.,,,,,
https://www.rva311.com/rvaone/Requests/ViewRequestDetail?requestId=DPW000008789&type=new_cs180221192758&viewRole=,DPW000008789,Assigned,"September 28, 2018 12:42 pm",Bagged trash put out for collection. New resident moved in and bags not collected on collection day. In the rear alley.,,,,,
https://www.rva311.com/rvaone/Requests/ViewRequestDetail?requestId=DPW000008788&type=new_cs180301154109&viewRole=,DPW000008788,Completed,"September 28, 2018 12:35 pm",there are potholes in the area.,,,,,
https://www.rva311.com/rvaone/Requests/ViewRequestDetail?requestId=DPW000008787&type=new_cs180221194457&viewRole=,DPW000008787,Assigned,"September 28, 2018 12:35 pm","Tall grass and trash, blocking the side walk. School children must walk in the street. Needs immediate attention.",,,,,
https://www.rva311.com/rvaone/Requests/ViewRequestDetail?requestId=DPW000008786&type=new_cs180301154109&viewRole=,DPW000008786,Completed,"September 28, 2018 12:12 pm","Caller states right as she's coming off 95, she hit a very large pot hole on Commerce, before you get to Bells Rd.",,,,,
https://www.rva311.com/rvaone/Requests/ViewRequestDetail?requestId=DPW000008785&type=new_cs180221194656&viewRole=,DPW000008785,Assigned,"September 28, 2018 12:11 pm",Communications called stating the citizen put in a request for removal of city tree several years ago. She called to follow up.,,,,,
https://www.rva311.com/rvaone/Requests/ViewRequestDetail?requestId=DPW000008784&type=new_cs180301154109&viewRole=,DPW000008784,Assigned,"September 28, 2018 12:10 pm",Temporary fix of the curb by the city years ago is crumbling away. Resident wants permanent concrete fix,,,,,
https://www.rva311.com/rvaone/Requests/ViewRequestDetail?requestId=DPW000008781&type=new_cs180221194656&viewRole=,DPW000008781,Assigned,"September 28, 2018 11:54 am","Two dead trees dropping limbs in this location, needs to be cut down as soon as possible",,,,,
https://www.rva311.com/rvaone/Requests/ViewRequestDetail?requestId=DPW000008779&type=new_cs180221194656&viewRole=,DPW000008779,Assigned,"September 28, 2018 11:49 am",Stump Grind of tree that was recently removed.thx,,,,,
https://www.rva311.com/rvaone/Requests/ViewRequestDetail?requestId=DPW000008775&type=new_cs180301154109&viewRole=,DPW000008775,Completed,"September 28, 2018 11:39 am","There is a large pot hole on the 3800 block of Augusta Ave, in front of Bliley Funeral Home, approximately 6"" deep red clay and large river stone surround the hole",,,,,
https://www.rva311.com/rvaone/Requests/ViewRequestDetail?requestId=DPW000008774&type=new_cs180221194032&viewRole=,DPW000008774,Assigned,"September 28, 2018 11:22 am",Please investigate this request asap this Asphalt alley need to be repair its full of potholes damaging cars regularly A1B1.,,,,,
https://www.rva311.com/rvaone/Requests/ViewRequestDetail?requestId=DPW000008773&type=new_cs180221194656&viewRole=,DPW000008773,Assigned,"September 28, 2018 11:20 am",Citizen stated huge city tree needs trimming. She said she is afraid the limb is going to break.,,,,,
https://www.rva311.com/rvaone/Requests/ViewRequestDetail?requestId=DPW000008770&type=new_cs180221194457&viewRole=,DPW000008770,Assigned,"September 28, 2018 11:08 am",residnet is calling in because the grass is so over grown that its coming onto the side walk where people have to wait for the bus . and needs to be cut ASAP,,,,,
https://www.rva311.com/rvaone/Requests/ViewRequestDetail?requestId=DPW000008769&type=new_cs180221194032&viewRole=,DPW000008769,Assigned,"September 28, 2018 11:06 am",Caller states it is a concrete alley - numerous pot holes.,,,,,
https://www.rva311.com/rvaone/Requests/ViewRequestDetail?requestId=DPU000001952&type=new_cs180226204420&viewRole=,DPU000001952,Completed,"September 28, 2018 10:51 am",Street light runs off and on during the daytime. Pole # AA57,,,,,
https://www.rva311.com/rvaone/Requests/ViewRequestDetail?requestId=DPW000008765&type=new_cs180221194032&viewRole=,DPW000008765,Completed,"September 28, 2018 10:47 am",Please repair Asphalt alley full of potholes asap. A1B1,,,,,
https://www.rva311.com/rvaone/Requests/ViewRequestDetail?requestId=DPW000008764&type=new_cs180221194656&viewRole=,DPW000008764,Assigned,"September 28, 2018 10:46 am","There is a maple tree in front of the house at 1220 Stanhope Avenue that has been slowly dying and dropping large branches during wind or rain. I have avoided reporting it because there was a squirrel drey in it that I did not want to disturb. However, it has recently gotten to the point where most of the branches are dead and it is a risk to the houses and cars around it.",,,,,
https://www.rva311.com/rvaone/Requests/ViewRequestDetail?requestId=DPW000008763&type=new_cs180221194457&viewRole=,DPW000008763,Assigned,"September 28, 2018 10:39 am",Brush blocking travel lane in road.,,,,,
https://www.rva311.com/rvaone/Requests/ViewRequestDetail?requestId=DPW000008762&type=new_cs180301154109&viewRole=,DPW000008762,Assigned,"September 28, 2018 10:36 am",Resident at 4332 Kingcrest said sidewalk is not aligned with other parts of the sidewalk. Requesting maintenance.,,,,,
https://www.rva311.com/rvaone/Requests/ViewRequestDetail?requestId=DPW000008761&type=new_cs180301154109&viewRole=,DPW000008761,Completed,"September 28, 2018 10:29 am",resident is calling in because there are three pot holes right by the stop sign to the right,,,,,
https://www.rva311.com/rvaone/Requests/ViewRequestDetail?requestId=DPW000008759&type=new_cs180221194656&viewRole=,DPW000008759,Assigned,"September 28, 2018 10:25 am",A resident alerted our office that there is a large limb in a tree that is hanging over the street. The limb is large enough that if it falls it will cause considerable danger to persons or property,,,,,
https://www.rva311.com/rvaone/Requests/ViewRequestDetail?requestId=DPW000008758&type=new_cs180221192758&viewRole=,DPW000008758,Assigned,"September 28, 2018 10:17 am",trash was placed out on Wednesday night was supposed to have been pick up on Thursday,,,,,
https://www.rva311.com/rvaone/Requests/ViewRequestDetail?requestId=DPU000001951&type=new_cs180226204420&viewRole=,DPU000001951,Completed,"September 28, 2018 10:14 am","2 lights out, 1 at 1401 W. Laburnum & 1 at 1405 W. Laburnum Ave",,,,,
